name,link,bio,image,special_id,collected_at
ARTEX: Revolutionizing Art Investment and Democratizing Access to Masterpieces,https://magazine.artland.com/artex-revolutionizing-art-investment-and-democratizing-access-to-masterpieces/,"Article
ByArtland Editors
“Before starting ARTEX, we realized that we are, above all, art lovers“
In a world where art has often been perceived as an exclusive asset class for the ultra-wealthy, ARTEX Global Markets (hereinafter ARTEX) is pioneering a revolutionary approach to democratizing art investment. At the helm of this groundbreaking venture is Yassir Benjelloun-Touimi, Co-Founder & CEO, a passionate art lover and visionary leader who is on a mission to make high-value art accessible to everyone. Alongside Yassir is H.S.H. Prince Wenceslas of Liechtenstein, Chairman & Co-Founder, whose unique background in both art and banking has been instrumental in bridging these two worlds. His extensive knowledge of the art market, combined with his financial expertise, helps guide ARTEX’s mission to merge traditional investment strategies with the beauty and cultural significance of fine art. In an insightful conversation, Yassir shares the journey behind ARTEX, the challenges of bringing this concept to life, and the future he and Prince Wenceslas envision for art investment.
“Before starting ARTEX, we realized that we are, above all, art lovers,” says Yassir. His passion for art dates back to his early years when he moved to France to immerse himself in the rich art scene of Paris. This deep-rooted love for art, combined with a keen understanding of the art market’s dynamics, laid the foundation for ARTEX.
Yassir identified a significant gap in the art market: the vast majority of art buyers who purchase works for under $100,000 have a high probability of seeing their investment depreciate over time. Conversely, only a select few can afford artworks worth millions, which almost certainly appreciate in value. ARTEX aims to bridge this gap by enabling collective ownership of high-value artworks, thereby allowing more people to benefit from the appreciation of valuable art.
“We wanted to make it possible for most people to not only love art but also benefit from its virtues and value appreciation,” Yassir explains. ARTEX achieves this by creating an exchange—a highly regulated platform where individuals can invest in shares of high-value art pieces.
The foundation of ARTEX lies in its rigorous curation process. Yassir emphasizes that the quality of the underlying asset is paramount. “We consider the artist as the brand,” he notes. ARTEX focuses on artists who have proven their worth over time, with most having sold works for over $40 million. Their selection process hinges on three criteria: the quality, rarity, and provenance of the artwork.
ARTEX targets pieces from the peak periods of the most relevant artists. For example, they aim to bring a 1932 Picasso or a 1960s Francis Bacon to the platform—works that represent the zenith of these artists’ contributions to art history. By doing so, they enhance the investment quality for their clients and ensure that the artworks maintain their value over time.
ARTEX goes beyond merely offering investment opportunities; it also aims to educate the public about art. “Most people love art but don’t feel they belong,” Yassir remarks. To address this, ARTEX provides accessible information about the art market and its artists, demystifying what has traditionally been an exclusive world.
“We focus on a few of the most important artists and deliver information in the simplest possible way,” Yassir says. ARTEX’s goal is to create a narrative that resonates with people, making art appreciation more inclusive and less daunting. They also collaborate with museums to lend artwork, thereby allowing more people to experience these masterpieces firsthand.
Building ARTEX has been a journey filled with complexities, from acquiring licenses to gaining the trust of banks and collectors. Yassir candidly describes the process as “very, very complicated.” However, he attributes the success of ARTEX to an unwavering commitment to their mission. “My experience in leadership has been centered around one thing: never give up,” he asserts.
Yassir and his team have navigated numerous hurdles, driven by a deep belief in the value they are bringing to society. They have had to adapt and refine their approach many times, but this persistence has fostered a company culture rooted in passion, humility, and resilience. This determination has also attracted a network of supporters who believe in the transformative potential of ARTEX.
ARTEX is not just reshaping the art market; it is redefining how society interacts with art. By allowing people to invest as little as $100 in high-value art, ARTEX opens the door for a broader audience to partake in the art market. Yassir envisions a future where art is not just a cultural treasure but also a viable and accessible investment for everyone.
In addition to providing investment opportunities, ARTEX plays a vital role in supporting museums and cultural institutions. Many museums struggle to fund the conservation and exhibition of artworks. ARTEX lends high-caliber art to these institutions, ensuring that masterpieces continue to be accessible to the public while also serving as a magnet to draw more visitors.
ARTEX’s innovative approach has garnered international attention, including an invitation from Harvard to be featured as a case study.The Harvard Business School case studydelves into ARTEX’s business model, providing a platform for in-depth discussions about the future of art investment. Yassir recounts the honor of engaging with some of the brightest minds at Harvard, where the story of ARTEX sparked enthusiasm and generated thought-provoking dialogue.
“It was amazing to see the engagement and the popularity of the subject,” Yassir reflects. This recognition not only underscores the impact of ARTEX’s mission but also highlights the growing interest in alternative investments and the evolving role of art in society.
“We wanted to make it possible for most people to not only love art but also benefit from its virtues and value appreciation”
ARTEX is at the forefront of a new era in the art world—one that champions accessibility, education, and the democratization of art investment. By offering a platform that combines quality, protection, and freedom, ARTEX is making it possible for more people to engage with and benefit from the world of high-value art. Through perseverance, innovation, and a commitment to cultural enrichment, Yassir Benjelloun-Touimi and his team are redefining what it means to invest in art.
In a market historically reserved for the elite, ARTEX is paving the way for a more inclusive future where art lovers and investors alike can partake in the appreciation and preservation of cultural heritage. As Yassir puts it, “This is the most important thing I’m doing in my life,” and its impact is only just beginning.
More articles from Artland Magazine you may like:Artland Interviews: Sophie NeuendorfIn Conversation With Julie Leopold, Founder and CEO of Enter Art FairAn Exclusive Conversation with VOLTA’s New Artistic Director, Lee Cavaliere
Other relevant sources:ARTEX Global MarketsHarvard Case",https://usercontent.one/wp/magazine.artland.com/wp-content/uploads/2022/06/artland-magazine-170px.svg?media=1690186145,data_1175c0cd04573bf6e0e14010111b8038_20240926195517,2024-09-26 19:55:17.915920
"Interview: Sophie Neuendorf, Vice President of Artnet",https://magazine.artland.com/sophie-neuendorf-interview/,"Interviews
The Vice President of Artnet on Growing Up in the Art World, Innovation in the Art Market, and the Power of List-Making
ByArtland Editors
“I’ve seen several different sides of the market…and that’s quite valuable.”
In an exclusive interview with Artland Magazine, Sophie Neuendorf, Vice President of Artnet, shared her unique journey through the art world – a blend of heritage and innovation. From the quiet of the Spanish countryside, she took a moment to reflect on her multifaceted career and her trajectory in the art world, rooted in a lifetime of experiences, familial legacy, and a deep commitment to fostering artistic talent.
Sophie’s introduction to the art world was nothing short of organic. “I feel like I’ve been born into the art world,” she remarked, recounting her father’s initial ventures as an art dealer in Hamburg. Her early memories include mingling with prominent figures like Leo Castelli and being surrounded by works from the likes of Warhol and Lichtenstein. This upbringing was not merely about exposure; it instilled in Sophie a nuanced comprehension of both the creative and commercial facets of the art market.
The family’s move to New York when her father, Hans Neuendorf, founded Artnet further immersed her in the industry’s heartbeat. Her career trajectory took her through various roles. From interning at Christie’s early on in her career to pivotal positions at Artnet, including Gallery Network and Partnerships Director and her current role as Vice President, Sophie experienced different angles of the art industry. “I’ve seen several different sides of the market…and that’s quite valuable. It’s been very helpful for my life today,” she noted.
Among her numerous responsibilities, Sophie takes pride in the Neuendorf Residency in Mallorca, a project that further adds to the Balearic islands’ thriving art scene. “We wanted to create something of value,” she explained. The residency was born out of a desire to keep their family summer house alive and soulful while also providing support to emerging artists. By converting an extra building into a studio, the Neuendorf family established a haven where creativity could flourish inspired by the Mediterranean land and seascape and the striking minimalist architecture specially designed by John Pawson and Claudio Silvestrin for the Neuendorf family in the late ‘80s.
Setting up his temporary studio at the Neuendorf House this year is William Monk, but the residency has already hosted several notable artists, including Louise Giovanelli, Christine Safa, and Nathanaëlle Herbelin, whose work was featured this spring at the Musée d’Orsay as part of the museum’s project dedicated to emerging artists who are gaining critical acclaim. “The synergies were just amazing,” Sophie said, highlighting the collaboration between the residence, the artists, their galleries, and Artnet News, which supports the project and the artists editorially to help bridge the gap between art creation and market engagement.
“One thing that you have that nobody can ever take away from you is your knowledge. And then when you have that, my advice is to give it back.”
Beyond her executive role at Artnet, Sophie is also a professor at IE University in Madrid. “They wanted the angle that I was passionate about: the intersection between art and finance,” she shared. Her goal is to demystify the art market’s complexities for her students, emphasizing the importance of data-driven decision-making and understanding art as both a cultural and financial asset.
Sophie’s commitment to education extends her influence, preparing the next generation to navigate the art world with a balanced view of passion and practicality and debunking the misconceptions about the art world being all exhibition openings and champagne. “There’s a lot of career opportunities in the art world for people studying business… not only as gallerists,” she noted. “The amount of people knowledgeable about art and finance and business is still relatively limited, but that’s something that’s going to be more asked for in the future. So that’s the kind of knowledge I want to give them.”
Managing her extensive responsibilities requires meticulous organization. When asked how she juggles her diverse array of projects and her busy schedule, she revealed her inclination toward list-making and setting reminders on her phone. The rest is just about prioritizing and organizing effectively. “It’s a bit of the work smarter, not harder thing,” she said.
In an industry that is still predominantly male-dominated, Sophie’s journey has not been without challenges. She explained how she often felt underestimated at the beginning of her career – although this turned into an opportunity sometimes, “you overdeliver against expectation,” she reflected. Her advice to young women aspiring to leadership roles is to invest in one’s own education and training to be able to understand as many aspects as possible of an art business, not only the art part. “One thing that you have that nobody can ever take away from you is your knowledge. And then when you have that, my advice is to give it back.” Her recommendation comes from experience as she has expanded on her education with courses on executive finance, ESG reporting, global politics and economics, and now sits in two boards.
While initiatives like the Neuendorf Residency show the commitment to fostering and supporting artistic talent, Sophie’s vision for the future seems to involve a more sustainable and dynamic art world where business acumen and artistic passion coexist harmoniously.
Looking ahead, Sophie sees the art market evolving, with a greater emphasis on transparency and data. Tokenization is a valuable solution, she says, if adopted widely. “Gallerists, above all, need to understand that it’s in their best interest to have this type of transparency.”
Experience has taught her that the art industry can be slow to adapt to innovation. She recalls times when forward-thinking initiatives, such as online auctions, were launched ahead of their time but were only fully embraced by the art world years later. “Sometimes the art market just needs time to catch up,” she says.
More articles from Artland Magazine you may like:In Conversation With Leading Art Market Expert and Best-Selling Author Magnus ReschDavid Shrigley: “Do What You Want to Do, Try Not to Get Bored”Interview with Mary Rozell, Global Head UBS Art Collection
Other relevant sources:The Neuendorf Residency",https://usercontent.one/wp/magazine.artland.com/wp-content/uploads/2022/06/artland-magazine-170px.svg?media=1690186145,data_1175c0cd04573bf6e0e14010111b8038_20240926195517,2024-09-26 19:55:17.915920
In Conversation With Leading Art Market Expert and Best-Selling Author Magnus Resch,https://magazine.artland.com/magnus-resch-interview/,"Interviews
ByLucija Bravic
Recently published by Phaidon, a new book by best-selling author and art market expert Magnus Resch provides brilliant guidance on art collecting and demystifies the current global art market through a data-driven approach. In ‘How to Collect Art’, both seasoned collectors and newcomers to the art market can find useful tips and insights.
Drawing from the largest research study conducted on the art market, his twenty years of experience in the art industry and case studies with insiders in the field, Magnus distilled the best practices in the process of collecting art. He reflects on popular topics such as responsible art buying and the significance of building diversified art collections, both personal and institutional ones.
We had the pleasure of asking Magnus a few questions about his interest in the economics of art, his view on inclusivity in the industry, misconceptions about collecting practices, and much more.
“Why should you buy art? I advocate for what I call “responsible buying,” which entails purchasing art that speaks to you on a personal level.”
I am passionate about making the art market more transparent to encourage greater participation in art buying. I pursue this goal across various avenues: as a teacher at Yale, I educate MBA students and cultivate them into a new generation of collectors; through my books, I aim to reach a wider audience and impart knowledge about the art world; in my entrepreneurial endeavors, I leverage technology to democratize the market. For instance, I developed an app that functioned like Shazam for art, simplifying the process of art identification, while@larrys_list, showcases some of the most intriguing collectors worldwide and has become one of the most watched Instagram accounts in the art world. Through these diverse efforts, I strive to empower individuals to engage with and appreciate art in new and meaningful ways.
Absolutely, the art world operates on a global scale, with artistic creation flourishing in every corner of the globe, even in the most remote locations. However, the market itself tends to be concentrated in major hubs like New York, London, and Hong Kong. This poses a dilemma for galleries: should they prioritize proximity to the supply of art or to the demand? In my experience, I always advise galleries to prioritize proximity to the demand side, as ultimately, they need to sell their artwork.
Current research indicates that female artists, members of the LGBTQ+ community, and artists of color are facing significant underrepresentation in the art market. They are not given equal opportunities in terms of exhibitions, prices, sales, and gallery representation when compared to their male white peers. The art market is characterized by systemic inequality, where a small number of mostly white male painters dominate the industry. A shift of this magnitude will likely span generations, but we are witnessing significant changes already, propelled by the efforts of collectors like Pamela J. Joyner, who wrote the foreword to my book, and artists and gallerists, many of whom have also contributed to my book.
The gap between the top players and the rest of the market is widening rapidly. Currently, just 20 artists account for over 50% of the revenue in the auction market for contemporary art. Essentially, we’re witnessing the emergence of two distinct art worlds: one dominated by a select few active players in what can be described as the “holy land,” where art is treated as an investment and stardom is cultivated, and the other comprising the remaining 99.9% of the market. My book delves into these two worlds and emphasizes the significant impact that new collectors can have by supporting artists from the broader market.
The most prevalent misconception in the art market is the belief that art is inherently a sound investment. While this may hold true for a select group of artists, it doesn’t necessarily reflect the broader market reality. As members of the art world, our primary objective should be to encourage art lovers to become art buyers. Why should you buy art? I advocate for what I call “responsible buying,” which entails purchasing art that speaks to you on a personal level. By doing so, you’re not only supporting the artist and the gallery but also contributing to the broader artistic community. Additionally, art has the power to inspire and offer new perspectives, enriching your life in meaningful ways. Ultimately, art can bring joy and fulfillment, making it a worthwhile endeavor. So go ahead, buy art and let it enrich your life!
More articles from Artland Magazine you may like:David Shrigley: “Do What You Want to Do, Try Not to Get Bored” – The British artist on his latest book, the joys of self-publishing and why comedy is so importantThe Best Art Books of 2023The Year Ahead: the Art World in 2024 – Major Fairs, Trends & Exhibitions
Other relevant sources:Buy ‘How to Collect Art’ by Magnus Resch",https://usercontent.one/wp/magazine.artland.com/wp-content/uploads/2022/06/artland-magazine-170px.svg?media=1690186145,data_1175c0cd04573bf6e0e14010111b8038_20240926195517,2024-09-26 19:55:17.915920
