name,link,bio,image,special_id,collected_at
Christine Eyene,https://www.internationalcuratorsforum.org/people/christine-eyene/,"Christine Eyene (born Paris, 1970) is a Cameroonian art critic, art historian, and curator. Eyene is artistic director of the 5th edition of the Biennale Internationale de Casablanca.
Her previous exhibitions include: Embodied Spaces, Framer Framed Amsterdam (2015); Residual: Traces of the Black Body, New Art Exchange, Nottingham (2015) as part of FORMAT International Photography Festival; Basket Case II, National Gallery of Zimbabwe, Harare and Bulawayo (2014-15); WHERE WE’RE AT! Other voices on gender at the Summer of Photography, Bozar, Brussels (2014); George Hallett: Consigned for Future Memory, PR1 Gallery, University of Central Lancashire (2014), Gideon Mendel: Drowning World, Tiwani Contemporary, London (2013); Dak’Art Biennale, Dakar (2012); Photoquai Biennial, Paris (2011); and Brighton Photo Fringe, Brighton (2010).
Eyene created eye.on.art, a website which brings together art news, events, research and curatorial projects in 2010.",https://www.internationalcuratorsforum.org/wp-content/uploads/2009/11/Screenshot-2022-06-23-at-16.06.10-768x524.png,data_a478f401dc7d5fee5c6b49530448bbd6_20240926201300,2024-09-26 20:13:00.558771
Elisabetta Fabrizi,https://www.internationalcuratorsforum.org/people/elisabetta-fabrizi/,,https://www.internationalcuratorsforum.org/wp-content/uploads/2020/11/Sharjah-Biennial-2009-768x512.jpg,data_a478f401dc7d5fee5c6b49530448bbd6_20240926201300,2024-09-26 20:13:00.558771
Reem Fadda,https://www.internationalcuratorsforum.org/people/reem-fadda/,"Curator and art historian Reem Fadda has organised many international exhibitions and biennials, especially those pertaining to art and geopolitics in the Middle East. She is the Director of the Cultural Foundation, Abu Dhabi Department of Culture and Tourism. Previously, she was the Associate Curator, Middle Eastern Art, Abu Dhabi Project at the Guggenheim Museum (2010–2016) and Director of the Palestinian Association for Contemporary Art (PACA), Ramallah (2005–2007). She served as Academic Director for the International Academy of Art Palestine, Ramallah, which she helped found in 2006.
Her curatorial projects include Fruit of Sleep, Sharjah Biennial 13: Act II, Sursock Museum, Beirut (2017); Jerusalem Lives (Tahya Al Quds), The Palestinian Museum, Birzeit (2017); Not New Now, 6th Marrakech Biennale (2016); and the United Arab Emirates National Pavilion, 55th Venice Biennale (2013).
She holds a BA in English Language and Literature from Birzeit University, Ramallah, Palestine (2002) and an MA in Curating from Goldsmiths College, London (2005). Fadda was also awarded the eighth Walter Hopps Award for Curatorial Achievement in 2017, and received a Fulbright scholarship to pursue her PhD in the Department of History of Art and Visual Studies, Cornell University, Ithaca, US in 2008.
Born in 1979 in Kuwait, Fadda currently lives and works in Abu Dhabi.",https://www.internationalcuratorsforum.org/wp-content/uploads/2020/11/Sharjah-Biennial-2009-768x512.jpg,data_a478f401dc7d5fee5c6b49530448bbd6_20240926201300,2024-09-26 20:13:00.558771
Vidisha Fadescha,https://www.internationalcuratorsforum.org/people/vidisha-fadescha/,"Vidisha Fadescha (They/Them) is an artist-curator working across arts and cultural disciplines. They focus on collaborations, collectives and experiences as a norm-critical pedagogy to Queer hegemonies.
Reflecting upon intimacies on the dancefloor and how body movements are an archive of histories, violence and desire, in 2020, Fadescha exhibited “Burn All The Books That Call You The Unknown” in NSW supported by Parramatta Artists Studios and Australian Council for the Arts. They also installed a video at Kiran Nadar Museum of Art in New Delhi, titled “Qworkoholic Anonymous” that looks at queer labour and fatigue. Along with their collaborator Shaunak Mahbubani, they released “some dance to remember, some dance to forget” a performance video which illustrates trans intimacies and the role of law in affirming dignified lives for trans persons.
Vidisha opened an art & social space in New Delhi as “Party Office” in Jan 2020. As gatherings were suspended during the pandemic, they anchored their transfeminist and anti-caste interests through digital curatorial collaborations with Acud Macht Neu (Berlin), Nottingham Arts Mela (UK), Abr (India), @southasia.art and female:pressure (Berlin). Vidisha co-curated “Queer Futures Archive” (2020) and “Queer Futures Potluck Party” (2019) with Shaunak Mahbubani as After Party Collective. They also work closely with Jyotsna Siddharth building dialogues around caste and gender as Sive, a social-art lab and a transdisciplinary collective. Fadescha is also a sound artist, DJ and an event host at clubs and other informal gatherings. They are a founding member of collectives in India that counter cis-het male dominant music industry and were an artist at “The Nightlife Residency” by iprojectspace and The Neighbourhood in Beijing (2019) and invited artist for “Today Is Our Tomorrow” by Publics and Museum of Impossible Forms in Helsinki (2019).",https://www.internationalcuratorsforum.org/wp-content/uploads/2020/10/sive_1620-768x512.jpg,data_a478f401dc7d5fee5c6b49530448bbd6_20240926201300,2024-09-26 20:13:00.558771
Hu Fang,https://www.internationalcuratorsforum.org/people/hu-fang/,"Hu Fang is a fiction writer and art critic based in Guangzhou, China. He is co-founder of Vitamin Creative Space. His writings explore the forms and meanings of contemporary living. His books in English translation include the short story collection Dear Navigator (2014), and Towards a Non-intentional Space (2015), an essay book reflecting the research process of “Mirrored Gardens” designed by the Japanese architect Sou Fujimoto.",https://www.internationalcuratorsforum.org/wp-content/uploads/2022/11/17bosindentity-2_0-768x432.jpeg,data_a478f401dc7d5fee5c6b49530448bbd6_20240926201300,2024-09-26 20:13:00.558771
Adam Farah,https://www.internationalcuratorsforum.org/people/adam-farah/,"Adam Farah is an artist and composer born-n-raised in London and is a Capricorn Sun, Cancer Rising, Leo Moon. They also practise under and within the name free.yard – an ongoing situational and unstable project set up to engage with and merge curatorial, research, artistic and equitable communal practices; with a focus on the ever-expansive and nuanced creative endeavours and potentials that emerge from endz. free.yard casts a side-eye onto the oppressive and supremacist structures upheld within the complacent and performative liberal bubbles of the artworld/s, and in the long term desires to create collaborative moments for artists to connect, manifest and exhale under such weight.",https://www.internationalcuratorsforum.org/wp-content/uploads/2020/08/Elijah-Ibrahim-still-768x509.jpg,data_a478f401dc7d5fee5c6b49530448bbd6_20240926201300,2024-09-26 20:13:00.558771
Kevin Farmer,https://www.internationalcuratorsforum.org/people/kevin-farmer/,"Kevin Farmer is currently Deputy Director of the Barbados Museum and Historical Society (BMHS). Hehas lectured in Archaeology in the Department of History at the University of the West Indies(UWI), St. Augustine, Trinidad, and in the MA Heritage Studies program at the UWI Cave Hill, Barbados.
He has responsibility for museum exhibition programming and capital campaign fundraising over the past decade, that has developed a museum multipurpose open-air theatre, redevelopment of a Children’s Gallery, and community engagement through innovative exhibit public programming thatincorporates museum theatre performances. Mr. Farmer is co-editor of the publication entitled:Plantation to Nation: Caribbean Museums and National Identity. As the principal researcher on the Barbados Museum’s nomination to the Memory of the World Register, examining the location and condition of extant documents relating to slavery and the slave trade in the Caribbean, resulted in its successful inscription.
His research interests include the creation of cultural identity in post-colonial states, the role of museums in national development, the management and curation of archaeological resources and the role of heritage in national development.",https://www.internationalcuratorsforum.org/wp-content/uploads/2009/11/Screenshot-2022-06-23-at-16.06.10-768x524.png,data_a478f401dc7d5fee5c6b49530448bbd6_20240926201300,2024-09-26 20:13:00.558771
Alex Farquharson,https://www.internationalcuratorsforum.org/people/alex-farquharson/,"Alex Farquharson is a curator, writer and lecturer. He has been the Director at Tate Britain since 2015. He was the first Director of Nottingham Contemporary, which since opening in 2009 has become one of the leading centres for contemporary art in the UK. While his specialism is contemporary art, his exhibitions and programmes have often created dialogues between the art of today and historic and modern art.
Solo exhibitions he has curated or co-curated include Huang Yong Ping, Wael Shawky, Glenn Ligon, Frances Stark, Jack Goldstein, Lari Pittman, Thomas Demand, Klaus Weber, Danh Vo, Carol Rama, Mika Rottenberg and Alfred Kubin; and from Britain, James Gillray, David Hockney, Bridget Riley, Gustav Metzger, Richard Long, Simon Starling, Marvin Gaye Chetwynd and Pablo Bronstein.
Group exhibitions he has curated or co-curated include British Art Show 6 (Gateshead, Manchester, Nottingham, and Bristol), If Everybody had an Ocean (Tate St Ives & CAPC Bordeaux), Rights of Nature: Art and Ecology in the Americas (Nottingham Contemporary), and Aquatopia: the Imaginary of the Ocean Deep (Tate St Ives). His writings include Isa Genzken (Phaidon), Richard Wright (DCA), Thomas Demand (Prada Foundation) and Sean Landers (Kunsthalle Zurich), and he has often written for Frieze, Artforumand Art Monthly on both art and curating. He has taught and lectured widely, in particular on the Curating Contemporary Art MA at Royal College of Art. He is a Trustee of Raven Row and is currently a member of the Arts Council Acquisitions Committee.",https://www.internationalcuratorsforum.org/wp-content/uploads/2022/11/Hew-Locke-Sandy-Nairne-Rogert-Malbert-Andrea-Schlieker-Claire-Doherty-Alex-Farquharson-768x490.jpg,data_a478f401dc7d5fee5c6b49530448bbd6_20240926201300,2024-09-26 20:13:00.558771
Omer Fast,https://www.internationalcuratorsforum.org/people/omer-fast/,"Omer Fast is a video artist based in Berlin. Much of his work delves into the psychology of contemporary trauma, often relying on the blurring of memory and the retelling of actual events through cinematic convention.  Fast’s work moves beyond the formalities of the genre, pushing through reality and non-reality of his subject matter, and is ultimately about the status of the image as a tool to disseminate information, both real and manufactured.
In his work as a filmmaker, Omer Fast defines a new relationship between reality and fiction. He is interested in exploring the construction of narratives, in particular how stories change when told from different perspectives. Many of his recent works examine the shifting boundaries of modern conflict through the personal stories of those involved. Fast borrows from traditions of documentary, dramatization and fantasy, and use human emotions as stand-ins for the larger socio-political reality of contemporary warfare.
His work has been exhibited extensively in the United States and internationally. In October 2015, a monographic exhibition of Fast’s work titled Present Continuous opened at the Jeu de Paume, Paris, and subsequently travelled to the Baltic Center of Contemporary Arts, Gateshead, UK, and the KUNSTEN Museum of Modern Art, Aalborg. Denmark. He has been the subject of solo exhibitions at the Times Museum in Guangzhou, China; Minneapolis Institute of Art, MN; Stedelijk Museum in Amsterdam, the Netherlands; Moderna Museet, Stockholm, Sweden; Le Caixa, Madrid, Spain; Musée d’Art Contemporain, Montréal, Canada; Museum of Contemporary Art, Krakow, Poland; STUK Leuven, Belgium; Dallas Museum of Art, TX; Cleveland Museum of Art, OH; the Art Institute of Chicago, IL; the Minneapolis Institute of Art, MN; and the Whitney Museum of American Art, NY. His work was featured in dOCUMENTA (13), the 54th Venice Biennale, and the 2002 and 2008 Whitney Biennials. Fast’s work is included in the permanent collections of numerous institutions, including the Whitney Museum of American Art, Solomon R. Guggenheim Museum and the Metropolitan Musuem of American Art in New York, NY; Los Angeles County Museum of Art, CA; Tate Modern, London, UK; Centre Georges Pompidou, Paris, France; and the Stedelijk Museum, Amsterdam, The Netherlands among others. Fast lives and works in Berlin, Germany.",https://www.internationalcuratorsforum.org/wp-content/uploads/2022/11/BB6_Petrit_Halilaj_15_300dpi-768x555.jpeg,data_a478f401dc7d5fee5c6b49530448bbd6_20240926201300,2024-09-26 20:13:00.558771
Azadeh Fatehrad,https://www.internationalcuratorsforum.org/people/azadeh-fatehrad/,"Dr. Azadeh Fatehrad is an artist and curator based in London. Fatehrad’s research, artistic and curatorial practice are intertwined around a process of gathering information and generating new imagery in response to archival material she discovers. Her interdisciplinary research overlaps discourses such as political science, sociology, representation, photography and architecture, as well as cultural studies.
Her practice ranges from still and moving images to fictional stories, short films and artist books which have been exhibited internationally at the Royal Academy of Art (London), Somerset House (London), Weltkulturen Museum (Frankfurt am Main), Index: The Swedish Contemporary Art Foundation (Stockholm), Lychee One Gallery (London) and The Barn Gallery (Oxford), among others.
Fatehrad has received her practice-based PhD from the Royal College of Art (2016) and has conducted diverse projects across Europe and the Middle East, including at the Warburg Institute in London (Iconography: The Representation of Hand Gestures), Archiv für Forschung und Dokumentation Iran (AFDI) in Berlin (National Unity of Women’s Associations), the International Institute of Social History (IISH) in Amsterdam (Sediqeh Dowlatabadi’s Archive), and the Feminist Library in London (Adventures in the Archives); Weltkulturen Museum, Frankfurt am Main (Scharf Belichted – Objects of Desire in an Ethnographic Collection) and the Institute for Iranian Contemporary Historical Studies (IICHS) in Tehran.
Fatehrad’s recent publications including ‘Sohrab Shahid Saless-Exile: Displacement and the Stateless Moving Image’ (2020) by Edinburgh University Press, UK and The Poetics and Politics of the Veil in Iran: An Archival and Photographic Adventure (2019) by Chicago University Press. Her projects have been positively covered by the likes of the New York Times, Financial Times, CNN, Euronews, Guardian, and British Journal of Photography, among others. Fatehrad is co-founder of ‘Herstoriographies: The Feminist Media Archive Research Network’ in London and she is on the editorial board for the peer reviewed journal MAI: Feminism & Visual Culture in Gothenburg, Sweden.
",https://www.internationalcuratorsforum.org/wp-content/uploads/2017/02/Azadeh-Fatehrad-1.jpg,data_a478f401dc7d5fee5c6b49530448bbd6_20240926201300,2024-09-26 20:13:00.558771
Andreana Fatta,https://www.internationalcuratorsforum.org/people/andreana-fatta/,"Andreana Fatta is a Cypriot artist who has obtained a BA in Fine Art at Birmingham School of Art. Her artistic practice is predominantly research-based, and she works with installations and archiving. Interested in exploring the personal and collective Cypriot memories, her artwork is informed by her cultural displacement and heritage, expressing themes of colonisation, war, lost histories, and identities.
Her previous work focuses on the use of materials and objects belonging to a Cypriot woman, the artist’s grandmother, who is a subject of displacement, in a way to address Cyprus and its complex history. Conversing and exposing such apparently marginal stories allows room for knowledge and awareness.",https://www.internationalcuratorsforum.org/wp-content/uploads/2020/10/Matias-Serra-Delmar-768x512.jpg,data_a478f401dc7d5fee5c6b49530448bbd6_20240926201300,2024-09-26 20:13:00.558771
Mayssa Fattouh,https://www.internationalcuratorsforum.org/people/mayssa-fattouh/,"Mayssa Fattouh is a Barcelona-based independent writer, curator and cultural practitioner interested in intersections of art and knowledge production. She is the co-founder of the temporary public art platform TandemWorks and a member of the experimental online journal continent.cc.",https://www.internationalcuratorsforum.org/wp-content/uploads/2020/11/Sharjah-Biennial-2009-768x512.jpg,data_a478f401dc7d5fee5c6b49530448bbd6_20240926201300,2024-09-26 20:13:00.558771
Nicolas Faubert,https://www.internationalcuratorsforum.org/people/nicolas-faubert/,"Nicolas Faubert was born in Libreville, Gabon and now lives and works in Paris, France. Faubert is a dancer and performer with a visual impairment and has developed signature engagements with movement and space.
Dance allows Faubert to explore the limits of consciousness and he absorbs new movements, often bringing together classical dance with Hip-Hop, Popping, B-Boying and Freestyle movements. Through hybrid performances, Faubert breaks down the barriers between disciplines (dance, visual arts, sound, photography) and social contexts, in order to allow meaningful access to culture for all. In 2018 Faubert was selected by Laure Prouvost to perform in the French Pavilion for the duration of the 58th Venice Biennale. Shortly after, Faubert undertook a two-year residency at the Cité Internationale des Artes in Paris focused on investigating new ways to feel and transcribe performance.",https://www.internationalcuratorsforum.org/wp-content/uploads/2022/05/PGDM-105-768x512.jpg,data_a478f401dc7d5fee5c6b49530448bbd6_20240926201300,2024-09-26 20:13:00.558771
Nicholas Faubert,https://www.internationalcuratorsforum.org/people/nicholas-faubert/,"Nicolas Faubert was born in Libreville, Gabon and now lives and works in Paris, France. Faubert is a dancer and performer with a visual impairment and has developed signature engagements with movement and space.
Dance allows Faubert to explore the limits of consciousness and he absorbs new movements, often bringing together classical dance with Hip-Hop, Popping, B-Boying and Freestyle movements. Through hybrid performances, Faubert breaks down the barriers between disciplines (dance, visual arts, sound, photography) and social contexts, in order to allow meaningful access to culture for all. In 2018 Faubert was selected by Laure Prouvost to perform in the French Pavilion for the duration of the 58th Venice Biennale. Shortly after, Faubert undertook a two-year residency at the Cité Internationale des Artes in Paris focused on investigating new ways to feel and transcribe performance.",https://www.internationalcuratorsforum.org/wp-content/uploads/2022/09/Nico-x-Kew3-copy-e1648641385857-768x599.jpg,data_a478f401dc7d5fee5c6b49530448bbd6_20240926201300,2024-09-26 20:13:00.558771
Cedric Fauq,https://www.internationalcuratorsforum.org/people/cedric-fauq/,"Cédric Fauq (b. 1992) is a Paris–based French curator. He is chief curator at Capc Musée d’art contemporain de Bordeaux. Prior to that he was a curator at Palais de Tokyo, Paris.
Previously, he worked as curator of exhibitions at Nottingham Contemporary, developing exhibitions including: Still I Rise: Feminisms, Gender, Resistance, Sung Tieu: In Cold Print, and Grace Before Jones: Camera, Disco, Studio; performances by Okwui Okpokwasili, Steffani Jemison and Lou Lou Lou Sainsbury; and publications.
He also writes, and develops freelance projects: DOC, Paris (2018); Sophie Tappeiner, Vienna (2018); Nir Altman, Munich (2019); Atlantis, Marseille with Wilfrid Almendra (2020)]. He co-directed clearview.ltd in London (2016-2018); and was a member of the Baltic Triennial XIII curatorial team (2017-2018).",https://www.internationalcuratorsforum.org/wp-content/uploads/2016/10/IMG_0702-768x512.jpg,data_a478f401dc7d5fee5c6b49530448bbd6_20240926201300,2024-09-26 20:13:00.558771
Cao Fei,https://www.internationalcuratorsforum.org/people/cao-fei/,"Cao Fei (b. 1978, Guangzhou) is an internationally-renowned Chinese contemporary artist. Currently living in Beijing, she mixes social commentary, popular aesthetics, references to Surrealism, and documentary conventions in her films and installations. Her works reflect on the rapid and developmental changes that are occurring in Chinese society today.
Cao Fei’s works have been exhibited at a number of international biennales and triennales, including the Shanghai Biennale (2004), the Moscow Biennale (2005), the Taipei Biennial (2006), the 15th & 17th Biennale of Sydney (2006 and 2010), the Istanbul Biennial (2007), the Yokohama Triennale (2008) and the 50th, 52nd & 56th Venice Biennale (2003, 2007 and 2015).
Cao Fei’s major projects in recent years include a solo exhibition at MoMA PS1, New York (2016), the Robert H. N. Ho Family Foundation Chinese Art Initiative at the Guggenheim Museum in New York (2018), a solo show at the Tai Kwun Contemporary, Hong Kong (2018), a retrospective at K21 Düsseldorf (2018), a solo exhibition at the Centre Pompidou, Paris (2019), a solo exhibition Blueprints at the Serpentine Galleries, London (2020). Cao Fei’s recent projects include a major retrospective Staging the Era at the UCCA Center for Contemporary Art, Beijing (2021), and a solo exhibition at the MAXXI, the National Museum of 21st Century Arts, Rome (2021).
Cao Fei is a professor and a master advisor of the School of Experimental Art at the Central Academy of Fine Arts. She was also on the jury of The Selection Committee for the Curatorship of the 8th Berlin Biennale (2014), the jury of The Bonnefanten Award for Contemporary (2016), and the jury of Hugo Boss Asia Art Prize (2019). Cao Fei is the nominator of the Rolls-Royce Art Program Muse (2019) and the winner of the Deutsche Börse Photography Foundation Prize (2021).",https://www.internationalcuratorsforum.org/wp-content/uploads/2022/11/17bosindentity-2_0-768x432.jpeg,data_a478f401dc7d5fee5c6b49530448bbd6_20240926201300,2024-09-26 20:13:00.558771
Bruce Ferguson,https://www.internationalcuratorsforum.org/people/bruce-ferguson/,,https://www.internationalcuratorsforum.org/wp-content/uploads/2022/11/17bosindentity-2_0-768x432.jpeg,data_a478f401dc7d5fee5c6b49530448bbd6_20240926201300,2024-09-26 20:13:00.558771
José Manuel Noceda Fernández,https://www.internationalcuratorsforum.org/people/jose-manuel-noceda-fernandez/,,https://www.internationalcuratorsforum.org/wp-content/uploads/2022/11/IMG_3099-768x512.jpg,data_a478f401dc7d5fee5c6b49530448bbd6_20240926201300,2024-09-26 20:13:00.558771
Lisa Le Feuvre,https://www.internationalcuratorsforum.org/people/lisa-le-feuvre/,"Lisa Le Feuvre is a curator, writer, editor and public speaker. In 2017 she was appointed the inaugural Executive Director of Holt/Smithson Foundation, an artist endowed foundation that aims to continue the creative and investigative legacies of the artists Nancy Holt and Robert Smithson.
Focusing on art as a powerful force to retune perceptions, Le Feuvre’s research takes the form of exhibitions, publications, collections and public lectures. Committed to communicating and testing ideas, she has curated exhibitions in museums and galleries across Europe, published her writings in international publications and journals, spoken in museums and universities across the world, and has played a pivotal role in shaping academic and arts organizations.
Between 2010 and 2017 Le Feuvre was Head of Sculpture Studies at the Henry Moore Institute, a part of the Henry Moore Foundation. She led a program of education, research, publications and exhibitions, and the development of the Leeds sculpture and collection archive. Previously Le Feuvre taught on the post-graduate Curatorial Program at Goldsmiths College, led the contemporary art program at the National Maritime Museum and was Course Director of the post-graduate program in Arts Policy and Management at Birkbeck College, University of London. She has sat on various juries including Sculpture Dublin (2021), Arnaldo Pomodoro Foundation Prize (2019),the Turner Prize (2018), Hepworth Prize for Sculpture (2016),[4] British representation at the Venice Biennale (2015),[5] the Max Mara Prize for Women (2013), and co-curated the quinquennial exhibition British Art Show 7: In the Days of the Comet (2009-10).",https://www.internationalcuratorsforum.org/wp-content/uploads/2022/10/wpid-1264780640image_web.jpeg,data_a478f401dc7d5fee5c6b49530448bbd6_20240926201300,2024-09-26 20:13:00.558771
Ray Fiasco,https://www.internationalcuratorsforum.org/people/ray-fiasco/,"Fiasco’s work deals with various themes, feelings, emotions and experiences that are fundamental in the shaping of our identities as digital kids in the western world. ‘There is a visual pulse within each piece’, as Ray’s pieces are often driven by the sounds he sees, giving this collection a musical undercurrent. The use of destruction in the creation process is perhaps the most pivotal metaphor in Fiasco’s work, one which the artist believes reflects the world we live in. With this in mind, the art allows us to reflect on our own personal life journeys, conflicts and how we view death and destruction.",https://www.internationalcuratorsforum.org/wp-content/uploads/2020/05/Michael-Forbes-Diaspora-Pavilion-768x512.jpg,data_a478f401dc7d5fee5c6b49530448bbd6_20240926201300,2024-09-26 20:13:00.558771
