name,link,bio,image,special_id,collected_at
"Nevena Prijic on Her Creative Process, Inspiration and a New Mural at the Worcester Art Museum",https://magazine.artland.com/nevena-prijic-interview-2/,"Interviews
ByShira Wolfe
“You know how the Vinča figurines look very simplified, and in that sense they also look contemporary? They look androgynous too, they’re non-binary. And I started developing this, they would just be these universal beings combining plants, humans, animal body parts, and connecting the past and the future. It’s like a hybrid creature.”
Nevena Prijic is a Serbian artist based in Los Angeles. Her vibrant abstract-figurative paintings combine intricate compositions with biomorphic forms—where plants, animals, humans and machines meet. Taking inspiration from artifacts of the Neolithic Vinča culture, active between  c. 5400 and 4500 BC in present-day Serbia and Kosovo and the largest settlement in European culture at the time along with the Cucuteni-Trypillia culture in present-day Ukraine and Romania, she develops these forms within her futuristic, transformative compositions. Prijic suggests a freedom of being through the avoidance of binary depictions and an emphasis on the interconnectedness of all things.
Shira Wolfe spoke with Prijic on the occasion of her new muralVoyager(2023) at the Worcester Art Museum (WAM).
How was the process of creating the mural at the Worcester Art Museum? You were there for two weeks right, that’s not much time!
I was there for 17 days. I’m insane, I work fast. I can’t really do anything else when I’m that focused. Especially the first few days, I was working non-stop. Until I could see that it was really coming along, I couldn’t relax. It also took getting used to because I was exposed working at the museum. So people were walking by or passing through, you know, they would go to look at the Kandinsky or some other masterpieces, and then pass by me.
Have you ever done this kind of public mural before?
I’ve only helped other artists complete their murals, but this is completely different because I had to adjust my method of painting that I usually do on canvas. You know, you have this whole system, and it’s different, because it’s on a wall, you can’t move it, and it’s huge. But in the end I think it looks great. My friends would say it looks exactly the same as on a canvas. There are a lot of details, and because it’s so big and exposed, it’s great because you can see all those details really well.
Will it stay there permanently?
It’s going to be there until the spring of 2025. I’m the first one who ever painted on that wall, and then they’ll do a rotation of artists every few years.
What is the story behind the mural? It obviously developed very naturally from your artistic practice and what you’ve been doing the past years.
I had a studio visit with a curator from the WAM in January this year, and we talked about the inspiration behind my work and the Neolithic Vinča culture, how it developed, and how the figures and the forms kind of started their own evolution. In the museum you see ancient artifacts and the progression to modern times. The mural is set between the third and fourth floor, the modern art collection is on the fourth floor, and right across from the mural is an ancient Mayan totem. The past and the future are all around. So I really wanted to do a sketch that relates to Vinča, where there are still traces, like the alien-looking head, the neck, the shoulders, the trunk, and the leg, but at the same time is transformed. You know how the Vinča figurines look very simplified, and in that sense they also look contemporary? They look androgynous too, they’re non-binary. And I started developing this, they would just be these universal beings combining plants, humans, animal body parts, and connecting the past and the future. It’s like a hybrid creature.
“In LA I discovered nature. So I started thinking about the similarities between plants and humans and machines, and began researching all that. I wanted to create something new, a new kind of human or being.”
Can you say more about how you started working with the Vinča culture? It was when you left Serbia for the States, right?
The Vinča culture is very famous in Serbia, and my dad was using those as a reference in his fine-print making. During one of my visits back home, maybe five years ago, my dad was like, “Do you want to take some of my artworks with you?” And I realized that I needed those forms to click with the drawings I was doing at the time. I was getting out of figurative painting and was trying to find ways to present a figure without being recognizable as a human. And with this, they represent a figure, but neither male nor female. So I started using those shapes of figurines and I would paint intricate drawings on top of them. Then I blended the figurine shapes with the drawings I was doing of organic shapes and cells, almost like what happens inside the body. When I merged those two, this came to be. It’s almost like creating a being in nature.
It must feel like a very free space.
Yes, it’s very creative, there are a lot of possibilities now. In my older work, it was a lot about transformation as well, how a body can change, how we can look like anything and anyone. It’s funny, I was working on how much the media impacted people here in Serbia, but once I moved to LA, I wasn’t interested in it anymore, and now I barely engage with this. In LA, I discovered nature. So I started thinking about the similarities between plants and humans and machines, and began researching all that. I wanted to create something new, a new kind of human or being.
How do you feel now that you’ve established your new creative language?
What I like about this phase is that with all the previous work, before I moved to the States, it was good and I liked it, but there was no room to develop it, and I would feel stuck. I don’t want to just create a new product, repeating the same thing over and over again. But with this more abstract work, there is the possibility of constant change and development. The progression is kind of insane. With every painting, I try to push a little bit. Taking a step back you can actually tell there are big changes.
I’m curious, who are some of your favorite artists?
My obsession for the human body and anatomy comes from the Italian Old Masters, when I was young I would be copying artworks by Leonardo Da Vinci. And even now the way I paint has traces in that, because the lines that I use for the top layer, the cross-hatching, have their root in those Renaissance drawings. Whenever I’m interested in something, then I discover artists who are doing something similar. Some contemporary artists whose work I find inspiring are Ivana Bašić, Christina Quarles, Alicia Adamerovich, and Teresa Chromati. A lot of times I’m drawn to sculpture too, because my paintings are quite sculptural.
What are some upcoming projects for you?
Next year I’ll have an exhibition in Milan with my LA gallery M+B, since they have spaces in Milan and Brazil too. The Milan space is a beautiful apartment where you can take your time and discuss art, it’s more homey than the in-and-out experience of the white cube. Other than that, I’ll spend more time developing and not rushing too much. Having a little bit of open space for thinking and experimenting.
Read other artist interviews in Artland Magazine:David Shrigley: “Do What You Want to Do, Try Not to Get Bored”Land of Dreams – Interview with Shirin NeshatArtist Interview:Jeffrey Gibson
Follow Nevena Prijic’s work here:Worcester Art MuseumNevena Prijic websiteNevena Prijic on InstagramM+B Gallery",https://usercontent.one/wp/magazine.artland.com/wp-content/uploads/2022/06/artland-magazine-170px.svg?media=1690186145,data_1175c0cd04573bf6e0e14010111b8038_20240926195517,2024-09-26 19:55:17.915920
"Interview: Simon Elliott, Creator of Hockney’s First-Ever Graphic Biography",https://magazine.artland.com/simon-elliott-interview-hockney-book/,"Interviews  ∙  Sponsored
ByAdam Hencz
“I hope that this book brings people joy. That is what Hockney’s story is all about.”
“I am a color addict,” confesses Simon Elliott, a criminal barrister by day, while preparing for an event for his latest illustrated book, ‘Hockney: A Graphic Life.’
“I have always lovedDavid Hockney,” Elliott resumes. “He loves the world and is always trying new ways to depict it.” This pure drive and shared curiosity is evident in every page of Elliott’s graphic novel that narrates Hockney’s life with the same zest and vibrancy that marked the life and art of the British Pop Art master.
“Hockney is in his eighties, and he’s still making works daily. He isn’t just making art in the ways he has always done—he is still searching. He is still reinventing himself. That is why I decided to write and draw a biography about him.”
Elliott’s dual career as a barrister and artist might seem at odds, yet there’s a confluence in their purpose: communication and curiosity. “Whether that argument comes from submissions in court or a painting on a canvas, it’s all a method of persuasion,” he muses, drawing a parallel between his legal battles and artistic expression.
Elliott’s passion for art was reignited during the pandemic, a silver lining in an otherwise gloomy period. “I used to spend all of my time drawing, painting, or making clay sculptures, but I hadn’t made much art since my school days,” he reflects.
But the lockdown changed everything, sparking a daily ritual of drawing and painting. He found himself reconnecting with his artistic roots in a period of global stillness.
“My parents are practical, hands-on people who always encouraged me to turn off the TV and make something instead. Now I am drawing again on a daily basis,” Elliott says, “and I am so grateful for making this change. I have really come to understand the mindfulness and mental health benefits of making artwork regularly.”
The seed for ‘Hockney’ was planted long ago, rooted in Elliott’s admiration for Hockney’s use of color, humor, and diverse mediums. “I particularly fell in love with ‘A Rake’s Progress,’ his series of etchings that depict his first time in America,” he shares.
The series includes witty asides that inspired Elliott’s approach to the graphic novel, capturing Hockney’s evolution in a similar style. “It is beautifully detailed sketch-like work that really speaks to me,” he adds. ”I wanted my book to mirror this — to achieve a balance between a biography and a graphic novel where the pictures do some of the narrative work.”
The publication of the book was almost serendipitous. “I was basically finished with the writing and drawing of it, but I hadn’t really thought of what I might do with it,” Elliott reveals. A positive response from the publisher and Hockney’s personal involvement in the project were turning points in bringing the book to life.
“He sent quite a lot of biographical notes,” Elliott recalls, “including correcting the plane that I had drawn for his first flight to New York, and one drawing where I had drawn him with his hands in his pockets, he insisted on smoking in the drawing as he had been in real life,” he adds.
“Hockney is 86 now, which means that there is a lot of ground to cover for a biography,” he explains, his fingers tracing over his iPad, the companion that brought freedom to his creative process.
“The iPad goes everywhere with me,” he says. “I draw on planes, trains, in the bath, wherever I happen to be,” he shares. Elliott’s illustrations, just like Hockney’s quarantine paintings, were drawn entirely on an iPad that infused the book with diverse inspirations, from the bustling streets of Japanese metropolises to the quiet, mundane moments.
Elliott reveals his next venture – an illustrated biography ofVincent Van Gogh. “He was an incredibly intellectual artist who produced many of the most famous images in the world in only a decade of painting,” he asserts.
His fascination with Van Gogh goes beyond the clichéd image of a tortured soul. He’s more intrigued by Van Gogh’s intellectual depth and the crucial roleJo Van Gogh Bonger, his sister-in-law, played in his fame after death.
Looking forward, Elliott’s artistic horizon is vast, with aspirations to explore the lives of other influential figures likeYayoi KusamaandTakashi Murakami,Basquiat, andDavid Shrigley.
If you’re seeking holiday gifts for fellow art lovers, give‘Hockney: A Graphic Life’ via Amazon!
Created by Artland for Simon Elliott, creator of Hockney’s first-ever illustrated biography.
David Shrigley: “Do What You Want to Do, Try Not to Get Bored”Art Movement: Pop Art10 Books Illustrated by Great Artists",https://usercontent.one/wp/magazine.artland.com/wp-content/uploads/2022/06/artland-magazine-170px.svg?media=1690186145,data_1175c0cd04573bf6e0e14010111b8038_20240926195517,2024-09-26 19:55:17.915920
"David Shrigley: “Do What You Want to Do, Try Not to Get Bored”",https://magazine.artland.com/david-shrigley-interview/,"Interviews
The British artist on his latest book, the joys of self-publishing and why comedy is so important.
ByAlice Godwin
David Shrigley is doing exactly what he wants when it comes to his latest book,I Am The Jug You Are The Glass(2022). Self-published through Shrig Shop in Copenhagen—which was founded with gallerist and friend Nicolai Wallner in 2021 and inspired by Keith Haring’s Pop Shop in 1980s New York—the book features three hundred black and white drawings from the past five years, filled with Shrigley’s distinctive sense of deadpan humor. The entire book is rendered in Shrigley’s familiar, childlike scrawl, from the publication details down to the barcode.
A lot has happened over the past half decade. In 2020, Shrigley was awarded an OBE by Queen Elizabeth II, which he found “unexpected and quite a strange thing to happen, but kind of positive.” Then there was the COVID-19 pandemic, which brought travel grinding to a halt. Shrigley enjoyed the opportunity to stay at home in rural Devon in south-west England and draw all day. Through this extraordinary period, Shrigley thinks his humor has not really changed. Instead, “I’ve realized the value of humor. I value it more now probably.”
This book offers a dose of wry Shrigley humor, which has garnered an international following. “I create a certain kind of comedy that people respond to,” Shrigley says. “Comedy is important, people like to laugh, but ultimately, I don’t know why people like it…you have to ask them!” For Shrigley, an artwork has to be for the artist first and foremost, “because if you don’t like it, you can’t expect anyone else to.” Shrigley acknowledges that, at times, his humor might be a little close to the bone, but it doesn’t necessarily matter what you do in the studio: “What matters is who you show the work to and when you show it to them.”
Though far from the first publication for the Turner Prize-nominated artist, Shrigley has relished the freedom of designing and editing this book himself—a process he intends to continue in the future. “Publishing with a bigger publisher is a bit of a pain in the arse,” he explains, “because you have to do it on their terms and jump through a lot of hoops.” When it comes to organizing an exhibition of his drawings, Shrigley has learned to hand over responsibility to the galleries he works with: “I always end up really surprised at what people choose. They don’t choose the things that I think are brilliant and amazing.” But this book is exactly the way he wants. In the past, Shrigley would lay out photocopies of all his drawings on a big table or the floor: “Now I do it on a computer, which is much easier and more sensible, but it’s still fun.”
For Shrigley, a book is a way to tie his drawings together in a cohesive narrative or structure. “It’s a way to give meaning to lots of individual parts,” he says, “which are then presented as a whole. That’s what I like about it.” When it comes to the meaning of his drawings, Shrigley is happy for people to make up their own minds: “It is about whatever the reader thinks it’s about.”
Shrigley has previously said that he began to draw because he had a lot to say, and drawing was the most direct way to say it. These days, Shrigley reflects, “I don’t know if I necessarily have a lot to say, but I have a need to say it, whatever it is. There’s definitely a difference there.” Shrigley’s drawings tussle with the resonance of words and images, and the slippage between the two, purposefully never using one to describe the other.
While the drawings inI Am The Jug You Are The Glassare all black and white, those in another recently published book,Get Your Shit Together, are in color (“so people can choose between the two or have both!”). For Shrigley, “there are things you can do with color works that you can’t do with black and white and vice versa. I swap between the two because you want to be able to examine everything.” By comparison, Shrigley suggests his black and white drawings are less self-contained and take less time to make than his color works. Their text is also potentially longer. When it comes to choosing between the two, Shrigley considers, “It’s a question of whatever works. Do what you want to do. Try not to get bored.”
I Am the Jug, You Are the Glass(€35) is available atshrigshop.com. Shrig Shop is on Tullinsgade 3, Copenhagen V, 2300, Denmark.
Read more articles from Artland MagazineStitching Stories: Interview with Textile Artist Peter FrederiksenKAWS: From Street Artist to Pop Art PhenomenonArtist Interview: Jeffrey Gibson
Other relevant sourcesLearn more aboutI Am the Jug, You Are the Glassat shrigshop.comDiscover works for sale by David Shrigley on Artland",https://usercontent.one/wp/magazine.artland.com/wp-content/uploads/2022/06/artland-magazine-170px.svg?media=1690186145,data_1175c0cd04573bf6e0e14010111b8038_20240926195517,2024-09-26 19:55:17.915920
UNCURATED COLLECTION in VR | Collector Interview,https://magazine.artland.com/uncurated-collection-vr-interview/,"Art Collecting Insights
ByBenedetta Ricci
“I think that finding new ways to display and share one’s collection via digital and virtual spaces is an exciting element for collectors and the artists that they support. This provides new opportunities for both parties to share the work with an audience as accessibility to the work is an important factor.”
UNCURATED COLLECTION is a diverse private art collection created by Estevan Maestas, featuring young emerging to mid-career visual artists with different backgrounds and from historically underrepresented communities and cultures.The collection is part of Artland’s campaign aiming to provide art collectors with new means for enjoying, curating, and sharing the artworks they cherish through cutting-edge VR technology.
Read our interview with Estevan Maestas below and learn more about his collecting journey, his goals as a collector, the importance of supporting living artists, and much more!
Discover the works from the UNCURATED COLLECTIONhere.
“Buy the art, invest in the artist.”
Growing up in Northern New Mexico, between Abiquiú, Taos, and Santa Fe, one of the top art markets in the United States, I’ve been surrounded by countless artists, galleries, museums, and art institutions from a young age. I frequented many gallery openings and events and formed great relationships with gallerists which led me to start my art collection. Later in life, at around the age of 20, I founded my first gallery, an online platform that represented early-career international artists, which provided me with the privilege of supporting creatives while building upon my collection at the same time.
Diverse, inspired, evolving.
The primary focus of my collection at its current stage is to support a diverse group of international artists of varied backgrounds, communities, and cultures with a focus on those who’ve historically been underrepresented, namely those in the LatinX, LGBTQIAP2S+, BIPOC, and AAPI communities, working across all mediums.
I’ve come to realize there is a recurring theme in the works I’ve collected which revolves around figurative depictions of human connection and embrace. There’s a certain relatability in those works that I resonate with and find comforting. Another notable visual element in my collection that has emerged over the years is vessels, vases, and amphorae. I’m intrigued by these historical forms and how the artists have interpreted and repurposed them to convey their message in a contemporized way.
There is a powerful work in my collection by David Heo, a Korean-American artist based in Chicago, that certainly makes an impact every time that I look at it. It is a collaged work on paper entitled, “Kinship” that – my personal interpretation – depicts a moment of suffering and unity between two individuals of differing backgrounds with seemingly shared experiences. It’s one of those works that is striking, thought-provoking, emotional, and empowering at the same time.
My taste has most definitely evolved from the early days of my collection’s formation. Initially, there was less of an objective when it came to acquiring works, although I still collected what I loved. Now I take a more considered approach especially as space constraints become a greater factor as the collection grows.
When considering an acquisition, I take into account how the work aligns with the direction and values of my collection, how I personally connect with the work, and most importantly how it benefits the artists.
As my collection has grown to well over 100 works, it is shared and displayed between my primary residence and family properties, if not in storage. I think that finding new ways to display and share one’s collection via digital and virtual spaces is an exciting element for collectors and the artists that they support. This provides new opportunities for both parties to share the work with an audience as accessibility to the work is an important factor.
I believe that as collectors, we are stewards of the work we are entrusted to own and live with, we must be responsible for how they are handled and presented. It’s important to be able to share the work and provide visibility for the artists, VR and digital platforms are a safe and effective way of reaching a greater audience.
David Heowill always be on my list of inspiring artists. His work will never cease to amaze and inspire.
Peruvian artist,Braddy Romero Ricaldeis another artist that I’m very excited about. His work has a playful yet powerful nature to it in such a unique style. The work he’s done in and for his community, writing, illustrating, and distributing bilingual children’s books for the children in the pueblos who do not have easy access to books is admirable.Marcelo Eli Sarmientois an artist that I’ve had the absolute pleasure of working with through my gallery as well as in my collection. His work tells a story through historical Latin American iconography in a refreshing contemporary style.
As I go forward, I intend to continue following the principles of my collection and support living, early-career artists across the art landscape. I always look forward to discovering and connecting with new creatives.
A common bit of advice that I have received, and the same advice that I’d give, is to just collect what resonates with you personally. Also, I will always advocate for investing in living artists. “Buy the art, invest in the artist.”
Explore the UNCURATED COLLECTIONhereFollow the UNCURATED COLLECTION on InstagramhereBrowse other private art collections and exhibitions in VR",https://usercontent.one/wp/magazine.artland.com/wp-content/uploads/2022/06/artland-magazine-170px.svg?media=1690186145,data_1175c0cd04573bf6e0e14010111b8038_20240926195517,2024-09-26 19:55:17.915920
