name,link,bio,image,special_id,collected_at
Paul Purgas,https://www.internationalcuratorsforum.org/people/paul-purgas/,"Paul Purgas is a London based artist and musician working with sound, performance and installation. Originally trained as an architect he has presented projects with Serpentine, Tate, Kettle’s Yard and Spike Island. His written output includes essays for the Unsound:Undead collection published by Urbanomic/MIT Press and contributions to the critical journal Audimat. Recent curatorial work has been the Open Sound programme for Outpost and guest curating Wysing Arts Centre’s annual festival. He is one half of the electronic music project Emptyset working with electroacoustic and computer music, broadcasting and spatialised sound, presenting commissions with the Architecture Foundation, David Roberts Art Foundation and Tate Britain’s Performing Architecture programme and recent performances including Sonic Acts, Wien Modern and Berghain for Transmediale 2020.",https://www.internationalcuratorsforum.org/wp-content/uploads/2022/11/Venice-2007-panel-768x454.png,data_a478f401dc7d5fee5c6b49530448bbd6_20240926201300,2024-09-26 20:13:00.558771
James Putnam,https://www.internationalcuratorsforum.org/people/james-putnam/,"James Putnam is an independent curator and writer. He studied Art History at London University and went on to join the Egyptian Antiquities and then the Education Departments of the British Museum having curated contemporary projects both for and independently of the Museum. In 1994 he curated the critically acclaimed exhibition ‘Time Machine’ which juxtaposed contemporary art with historical artefacts. He founded the British Museum’s Contemporary Arts and Cultures Programme in 1999 which relates to the philosophically rigorous role of museums: to examine and re-examine history, art and artefacts in the light of current cultural-related issues.
James Putnam initiates projects with a cross-disciplinary approach, working with visual and performing artists, designers, writers and cultural studies specialists. He develops residencies, installations, talks and performances and conferences in collaboration with national and international institutions. He has organized exhibitions at unusual venues which combine contemporary art with historic sites and artefacts, like the ongoing series of exhibitions he curates at the Freud Museum, London.
He is also a writer, having published both on ancient and contemporary art, including ‘Art and Artifact – the Museum as Medium’ (Thames & Hudson, 2001) which offers an extensive survey of the relationship between the artist and museum, a subject on which he also lectures.
James Putnam was a Visiting Scholar in Museum Studies at New York University, 2003-2004, Associate Curator at the Bowes Museum, County Durham, UK, 2004-2006, and Senior Lecturer – Criticism, Communication & Curation, University of the Arts, London, 2004-2011.
He is currently Senior Research Fellow,Exhibitions at the London College of Fashion, University of the Arts, London",https://www.internationalcuratorsforum.org/wp-content/uploads/2022/11/17bosindentity-2_0-768x432.jpeg,data_a478f401dc7d5fee5c6b49530448bbd6_20240926201300,2024-09-26 20:13:00.558771
Hoor Al Qasimi,https://www.internationalcuratorsforum.org/people/sheikha-hoor-bint-sultan-al-qasimi/,"Hoor Al Qasimi, President and Director of Sharjah Art Foundation, is a curator who established the Foundation in 2009 as a catalyst and advocate for the arts in Sharjah, UAE, as well as regionally and internationally. With a passion for supporting experimentation and innovation in the arts, Al Qasimi has continuously expanded the scope of the Foundation over its 10-year history to include major exhibitions that have toured internationally; artist and curator residencies in visual art, film and music; commissions and production grants for emerging artists; and a wide range of educational programming in Sharjah for both children and adults. In 2003, Al Qasimi co-curated Sharjah Biennial 6 and has since continued as Biennial Director. Under Al Qasimi’s leadership, Sharjah Biennial has become an internationally recognised platform for contemporary artists, curators and cultural producers. Her leadership in the field led to her election as President of the International Biennial Association (IBA) in 2017, an appointment that transferred IBA’s headquarters to Sharjah. Complementing her role at the Foundation, Al Qasimi also serves as the President of The Africa Institute and Chair of the Board for the Sharjah Architecture Triennial, which inaugurated its first edition in November 2019. Al Qasimi served as curator of the second Lahore Biennale (2020).
Since its establishment in 2009, Al Qasimi has curated several major exhibitions mounted by Sharjah Art Foundation, including Xenogenesis, presenting key works by The Otolith Group (2021–2022); Tarek Atoui: Cycles in 11 (2020–2021); Zarina Bhimji: Black Pocket (2020–2021); Amal Kenawy: Frozen Memory (2018–2019); the major retrospective Hassan Sharif: I Am The Single Work Artist (2017–2018), which travelled to KW Institute for Contemporary Art, Berlin (2020), Malmö Konsthall, Sweden (2020–2021) and the Musée d’art moderne et contemporain, Saint-Étienne, France (2021); Yayoi Kusama: Dot Obsession (2016–2017); and Robert Breer: Time Flies (2016–2017). Other notable projects include 1980–Today: Exhibitions in the United Arab Emirates, the UAE Pavilion at the 56th Venice Biennale (2015) and the solo exhibitions Simone Fattal (2016), Farideh Lashai (2016), Rasheed Araeen: Before and After Minimalism (2014) and Susan Hefuna: Another Place (2014), presented at Sharjah Art Foundation. Al Qasimi co-curated the landmark exhibition Joana Hadjithomas and Khalil Joreige: Two Suns in a Sunset (2016), which debuted in Sharjah and travelled to Jeu de Paume in Paris, Haus der Kunst in Munich and IVAM in Valencia, Spain. She also co-curated Bani Abidi: Funland (2019), which travelled to MCA Chicago as Bani Abidi: The Man Who Talked Until He Disappeared (2021–2022); Kamala Ibrahim Ishag: Women in Crystal Cubes (2019–2020), Prince Claus Fund Gallery, Amsterdam, following its 2016–2017 presentation at Sharjah Art Foundation; When Art Becomes Liberty: The Egyptian Surrealists (1938–1965) in Cairo (2016); and The Khartoum School: The Making of the Modern Art Movement in Sudan (1945–Present) in Sharjah (2016–2017).
Al Qasimi serves on the Board of Directors for Kunst-Werke Berlin e. V. in Germany and Ashkal Alwan in Beirut. She is the Chair of the Advisory Board for the College of Fine Arts and Design at the University of Sharjah and is a member of the advisory boards for Khoj International Artists’ Association, New Delhi; Darat al Funun, Amman; Independent Film Council, ICA, London and the Eye Art & Film Prize (2022–2024), Eye Filmmuseum, Amsterdam.
Previously, she was a board member for MoMA PS1 in New York (2010–2021), UCCA Center for Contemporary Art, Beijing (2013–2016) and a member of the Prince Claus Award Committee (2016–2020) as well as on the juries and prize panels for the PinchukArtCentre’s 5th edition of the Future Generation Art Prize (2019), Bonnefanten Award for Contemporary Art (2019), Maria Lassnig Prize (2017), Mediacity Seoul Prize (2016), Hepworth Wakefield Prize for Sculpture (2016), Berlin International Film Festival–Berlinale Shorts (2016), Videobrasil (2015), Dubai International Film Festival (2014) and Benesse Prize (2013).
Al Qasimi holds an MA in curating contemporary art from the Royal College of Art, London (2008). She earned a diploma in painting from the Royal Academy of Arts, London (2005) and received a BFA from the Slade School of Fine Art, London (2002).",https://www.internationalcuratorsforum.org/wp-content/uploads/2019/08/UNADJUSTEDNONRAW_thumb_3831-768x431.jpg,data_a478f401dc7d5fee5c6b49530448bbd6_20240926201300,2024-09-26 20:13:00.558771
Morgan Quaintance,https://www.internationalcuratorsforum.org/people/morgan-quaintance/,"Morgan Quaintance is a London-based artist and writer.
His moving image work has been shown and exhibited widely at festivals and institutions including: MOMA, New York; Mcevoy Foundaton for the Arts, San Francisco; Konsthall C, Sweden; David Dale, Glasgow; European Media Art Festival, Germany; Alchemy Film and Arts Festival, Scotland;  Images Festival, Toronto; International Film Festival Rotterdam; and Third Horizon Film Festival, Miami.
He is the recipient of the 2022 ARTE Award at Kurzfilm Festival Hamburg; in 2021, the Best Documentary Short Film Award at Tacoma Film Festival, USA; the Explora Award at Curtocircuito International Film Festival, Santiago de Compostela; the UK Short Film Award at Open City Documentary Film Festival, London, the Jean Vigo Prize for Best Director at Punto de Vista, Spain, and the Best Experimental Film Award at Curtas Vila do Conde, Portugal; in 2020, the New Vision Award at CPH:DOX, Denmark and the Best Experimental Film award at Curtas Vila Do Conde, Portugal .
Over the past ten years, his critically incisive writings on contemporary art, aesthetics and their socio-political contexts, have featured in publications including Art Monthly, the Wire, and the Guardian, and helped shape the landscape of discourse and debate in the UK.",https://www.internationalcuratorsforum.org/wp-content/uploads/2020/11/Mirage-2015-768x576.jpg,data_a478f401dc7d5fee5c6b49530448bbd6_20240926201300,2024-09-26 20:13:00.558771
Pilar Quinteros,https://www.internationalcuratorsforum.org/people/pilar-quinteros/,"Pilar Quinteros (Santiago, Chile, 1988). Lives and works in Barcelona.
Bachelor of Arts from the Pontifical Catholic University of Chile (2011).Winner of AMA Scholarship 2018 for a three months residency at Gasworks, London; special mention of the jury at the 31st Biennial of Graphic Arts of Slovenia(2015); finalist of the Future Generation Art Prize 2014; Winner of the third place of CCU Art Fellowship (2013) and winner of the Jean-Claude Reynal Scholarship 2012 (French Foundation in conjunction with the Museum of Fine Arts in Bordeaux).
Quinteros exhibited her work in places such as Folkestone Triennial 2021; 34º MDG Film Festival (Mar del Plata, Argentina, 2019); 2017 California-Pacific Triennial – Building as Ever (Newport Beach, California, USA); 32nd São Paulo Biennial – Live Uncertainty (São Paulo, Brazil, 2016); 31st Biennial of Graphic Arts – Over You-You (Ljubljana, Slovenia, 2015); PinchukArtCentre (Kiev, Ukraine, 2014); National Museum of Fine Arts (Santiago, Chile, 2013); Museum of Contemporary Art (Santiago, Chile, 2010), among others.",https://www.internationalcuratorsforum.org/wp-content/uploads/2022/11/alternative-universe-28.10-768x503.jpg,data_a478f401dc7d5fee5c6b49530448bbd6_20240926201300,2024-09-26 20:13:00.558771
Yinka Shonibare CBE RA,https://www.internationalcuratorsforum.org/people/yinka-shonibare/,"Yinka Shonibare CBE RA (b. 1962) in London, UK, studied Fine Art at Byam Shaw School of Art, London (1989) and received his MFA from Goldsmiths, University of London (1991). His interdisciplinary practice uses citations of Western art history and literature to question the validity of contemporary cultural and national identities within the context of globalisation. Through examining race, class and the construction of cultural identity, his works comment on the tangled interrelationship between Africa and Europe, and their respective economic and political histories.
In 2004, he was nominated for the Turner Prize and in 2008, his mid-career survey began at Museum of Contemporary Art, Sydney, travelling in 2009 to the Brooklyn Museum, New York and the Museum of African Art at the Smithsonian Institute, Washington D.C. In 2010, his first public art commission ‘Nelson’s Ship in a Bottle’ was displayed on the Fourth Plinth in Trafalgar Square, London and is in the permanent collection of the National Maritime Museum, Greenwich, London. In 2013, he was elected a Royal Academician and was awarded the honour of ‘Commander of the Order of the British Empire’ in 2019. His installation ‘The British Library’ was acquired by Tate in 2019 and is currently on display at Tate Modern, London.
In 2021, Shonibare was awarded the prestigious Whitechapel Gallery Art Icon Award. A major retrospective of his work opened at the Museum der Moderne, Salzburg in May 2021 followed by his co-ordination of The Royal Academy Summer Exhibition, London which opened in September 2021. The survey solo exhibition, Yinka Shonibare CBE: Planets in My Head, opened in April 2022 at Frederik Meijer Gardens & Sculpture Park, Grand Rapids, Michigan followed by the unveiling in June of a major new sculptural work, Wind Sculpture in Bronze I at Royal Djurgården, Stockholm.
Shonibare’s works are in notable museum collections internationally, including the Tate Collection, London; Victoria and Albert Museum, London; National Museum of African Art, Smithsonian Institute, Washington, D.C; Museum of Modern Art, New York; Moderna Museet, Stockholm; the Museum of Contemporary Art, Chicago; National Gallery of Modern Art in Rome and VandenBroek Foundation, The Netherlands.",https://www.internationalcuratorsforum.org/wp-content/uploads/2020/05/Yinka-Shonibare-Diaspora-Pavilion-768x512.jpg,data_a478f401dc7d5fee5c6b49530448bbd6_20240926201300,2024-09-26 20:13:00.558771
Khalil Rabah,https://www.internationalcuratorsforum.org/people/khalil-rabah/,"Khalil Rabah (b.1961, Palestine) studied fine arts and architecture at the University of Texas. His most recent solo exhibitions include Casa Árabe, Madrid (2016); Kunsthaus Hamburg (2015); e-flux, New York, (2013); and Beirut Art Center (2012). In addition to major group shows, including Manifesta 12 Palermo (2018); the Sharjah Biennial (2017); the Marrakech Biennale (2016); the Kochi-Muziris Biennale (2014); the Thessaloniki Biennial (2013); Mori Art Museum, Tokyo (2012); Mathaf, Doha (2010); and the Venice Biennale (2009).
Over the years, his work has been acquired by major institutions including MACRO, Rome; The British Museum, London; The Guggenheim, Abu Dhabi; Mathaf, Doha; Kunsthaus Zurich and The Sharjah Art Foundation.
Rabah is the initiator and artistic director of the Riwaq Biennale and a co-founder of Al Ma’mal Foundation for Contemporary Art in Jerusalem. He served on the curricular committee of Ashkal Alwan’s Home Workspace Program in Beirut, Lebanon from 2011 to 2015.",https://www.internationalcuratorsforum.org/wp-content/uploads/2022/11/Screenshot-2022-11-06-at-20.43.39-768x395.png,data_a478f401dc7d5fee5c6b49530448bbd6_20240926201300,2024-09-26 20:13:00.558771
Joanna Rajkowska,https://www.internationalcuratorsforum.org/people/joanna-rajkowska/,"Joanna Rajkowska, born in 1968, Bydgoszcz, Poland, is an artist based in Warsaw and London.
Rajkowska studied at the Academy of Fine Arts, Kraków, Poland, graduating with a Master’s Degree in mural painting in 1993, having already obtained an MA in History of Art from the Jagiellonian University in Kraków a year earlier. She extended her education at the State University of New York, participating in the Studio Semester Programme in 1994 and 1995.
A versatile artist, Rajkowska is best known for her work in public space, where she uses real-life situations, energies, organisms and materials to construct sites, installations and ephemeral actions. She utilises elements as diverse as plants, buildings, found objects, water, smoke or sound. De-familiarizing, de-humanizing and relating are her operating devices. She is interested in the limitations and the limiting of human activities, multiplicity of agencies and human and non-human relations.
The outcomes of her works range from urban axes and architectural projects, through geological fantasies, excavation sites to underwater sculptures. Both alongside and separately, she produces films, photographs and models.
Most of her works happen, live and age in public space. Thus, her practice embraces all the entities involved as well as their relations, including organic and inorganic beings. The artist understands her projects like organisms, as she focuses on matter in its molecular or cellular dimension, its life cycle, growth and ageing. With a strong conviction that we, as humans, have failed to produce a viable, sustainable culture, she often confronts historical and sociopolitical contexts with the lives of species other than human. Tinted with disappointment, her work visualizes and questions the notion of the nature-culture divide.
As a woman and a mother, she uses her own body, a biological machine and a tool that enables her to sense and understand the conditions set for her work. Disease, weakness and malfunction of the living body is very often in the backdrop of her work, providing a fertile ground of potentiality rather than failure. The introduction of the weak, the feminine and the limited into the public space, crossing the boundaries between the private and the public has been the most controversial edge of her practice.
Her work has been presented in the UK, Germany, Poland, France, Switzerland, Brazil, Sweden, USA, Bulgaria, Palestine, India, Japan, Turkey and Kenya among others.Her public projects include commissions by Frieze Sculpture 2019 (2019, The Hatchling, UK), United Nations Environment Programme (2019, Death of the Palm Tree, Poland), European Capital of Culture Wrocław (2016, Trafostation, Poland), Institute for Contemporary Ideas and Art (2014, Carpet, Sweden), Royal Society of Arts, Citizen Power Peterborough programme’s Arts and Social Change, Arts Council England (2012, The Peterborough Child, UK), Frieze Projects 2012 (2012, Forcing a Miracle, UK), 7th Berlin Biennale (2012, Born in Berlin, Germany), The Showroom (2010, Chariot, UK), British Council (2010, Benjamin in Konya, Turkey), Museum of Modern Art in Warsaw (2009, Ravine, Poland), CSW Zamek Ujazdowski (2007, Oxygenator, Poland), Trafo Gallery (2008, Airways, Hungary).
As well as commissions, she has realized a number of partisan public projects, most notably Greetings from Jerusalem Avenue in Warsaw (2002) which shaped the unique set of methods Rajkowska employs. The project was to become a major city landmark and has acted as a base for numerous political actions ranging from nurses’ protests to expression of solidarity with Ukraine during its invasion.
Her artwork has been presented in the UK, Germany, Poland, France, Switzerland, Brazil, Sweden, USA, Bulgaria, Palestine, India, Japan, Turkey and Kenya among others.",https://www.internationalcuratorsforum.org/wp-content/uploads/2018/09/IMG_7544-e1537281654346-768x512.jpg,data_a478f401dc7d5fee5c6b49530448bbd6_20240926201300,2024-09-26 20:13:00.558771
Michael Rakowitz,https://www.internationalcuratorsforum.org/people/michael-rakowitz/,"Michael Rakowitz is an Iraqi-American artist working at the intersection of problem-solving and troublemaking. His work has appeared in venues worldwide including dOCUMENTA (13), P.S.1, MoMA, MassMOCA, Castello di Rivoli Museo d’Arte Contemporanea, Palais de Tokyo, the 16th Biennale of Sydney, the 10th and 14th Istanbul Biennials, Sharjah Biennial 8, Tirana Biennale, National Design Triennial at the Cooper-Hewitt, Transmediale 05, FRONT Triennial in Cleveland, and CURRENT:LA Public Art Triennial. He has had solo projects and exhibitions with Creative Time, Tate Modern in London, The Wellin Museum of Art, MCA Chicago, Lombard Freid Gallery and Jane Lombard Gallery in New York, SITE Santa Fe, Galerie Barbara Wien in Berlin, Rhona Hoffman Gallery in Chicago, Malmö Konsthall, Tensta Konsthall, and Kunstraum Innsbruck, and Waterfronts – England’s Creative Coast. He is the recipient of the 2020 Nasher Prize; the 2018 Herb Alpert Award in the Arts; a 2012 Tiffany Foundation Award; a 2008 Creative Capital Grant; a Sharjah Biennial Jury Award; a 2006 New York Foundation for the Arts Fellowship Grant in Architecture and Environmental Structures; the 2003 Dena Foundation Award, and the 2002 Design 21 Grand Prix from UNESCO. He was awarded the 2018-2020 Fourth Plinth commission in London’s Trafalgar Square. From 2019-2020, a survey of Rakowitz’s work traveled from Whitechapel Gallery in London, to Castello di Rivoli Museo d’Arte Contemporanea in Torino, to the Jameel Arts Centre in Dubai. Rakowitz is represented by Rhona Hoffman Gallery, Chicago; Jane Lombard Gallery, New York; and Barbara Wien Galerie, Berlin; Pi Artworks, Istanbul; and Green Art Gallery, Dubai. He lives and works in Chicago.",https://www.internationalcuratorsforum.org/wp-content/uploads/2022/11/Screenshot-2022-11-06-at-20.43.39-768x395.png,data_a478f401dc7d5fee5c6b49530448bbd6_20240926201300,2024-09-26 20:13:00.558771
Dina Ramadan,https://www.internationalcuratorsforum.org/people/dina-ramadan/,"Dina A. Ramadan has been Assistant Professor of Arabic in the Division of Languages and Literature at Bard College Annandale since 2010. Dina is visiting professor at Bard College Berlin for fall 2018.
Dina holds a Ph.D. in Middle Eastern, South Asian, and African Studies from Columbia University, and a B.A. in English and Comparative Literature from the American University in Cairo. Her teaching interests include twentieth-century Arabic literature, the Arabic language, Middle Eastern cultural production (particularly film and visual arts), Arab intellectual thought, nationalism, and postcolonial theory. Dina’s current book project focuses on the development of the category of modern art and the relationship between aesthetics, education, and middle class subjectivity in early twentieth-century Egypt. She is also conducting research on cultural and artistic initiatives during the early years of the Nasserist regime. Dina has served as senior editor of the Arab Studies Journal since 2010, and guest edited a themed issued on the visual arts (Spring 2010). She is a founding member of the Association for Modern and Contemporary Art of the Arab world, Iran, and Turkey (AMCA). Articles, book chapters, and reviews published or forthcoming in Arab Studies Journal, Art Journal, Journal of Visual Culture, Middle East Studies Association Bulletin, Nka: Journal of Contemporary African Art and others. Dina has been invited to lecture on the cultural politics of the region at a number of museums and academic institutions including the New Museum, the Tate Britain and Modern, SOAS University of London, European University Institute and the American Research Center in Egypt. For the academic year 2013-14 she was a EUME post doctoral fellow at the Berlin-based Forum Transregionale Studien.",https://www.internationalcuratorsforum.org/wp-content/uploads/2022/11/Screenshot-2022-11-06-at-20.43.39-768x395.png,data_a478f401dc7d5fee5c6b49530448bbd6_20240926201300,2024-09-26 20:13:00.558771
Juan Sebastian Ramirez,https://www.internationalcuratorsforum.org/people/juan-sebastian-ramirez/,,https://www.internationalcuratorsforum.org/wp-content/uploads/2022/11/Venice-2007-panel-768x454.png,data_a478f401dc7d5fee5c6b49530448bbd6_20240926201300,2024-09-26 20:13:00.558771
Ras Akyem Ramsey,https://www.internationalcuratorsforum.org/people/ras-akyem-ramsey/,"A graduate of Jamaica’s Edna Manley School of Art, Ras Akyem I is a veteran exhibitor throughout the Caribbean, Latin America, England and the US. In 1996 Ras Akyem’s paintings won the Gold Medal at the Third Biennial of Caribbean and Latin American Painting, held in Santo Domingo, and was part of the collective submission by Barbadian artists which won the country a Gold Medal. Between 1995 and 1997 Ras Akyem successfully completed postgraduate studies at Cuba’s prestigious art academy, the University of Superior Arts (ISA). His work has been published and discussed in such publications as Barbadian Art: What Kind of Mirror Image? and Caribbean Art by Veerle Poupeye. In 1998 he was awarded the Barbados Service Star in that year’s Barbados Independence Honors. Ras Akyem is the recipient of the 2012 Caribbean Luminary of the Arts Award.",https://www.internationalcuratorsforum.org/wp-content/uploads/2016/09/John-Beadle.jpg,data_a478f401dc7d5fee5c6b49530448bbd6_20240926201300,2024-09-26 20:13:00.558771
