name,link,bio,image,special_id,collected_at
"Interview: Sara Berner Bengtsson, Director & CEO of Market Art Fair",https://magazine.artland.com/sara-berner-bengtsson-market-interview-2023/,"Interviews
ByBenedetta Ricci
“The fair holds the special position of bringing people together, from wealthy collectors and powerful industry professionals to artists and general art lovers. We want to make the most of this platform by raising important voices and discussions.”
As we await for this year’s iteration of Market Art Fair to open its doors, Artland had the pleasure to interview Sara Berner Bengtsson, Director and CEO of the fair.
Established in 2006 by galleries representing the Nordic countries, namely Denmark, Iceland, Finland, Norway, and Sweden, Market has become a trusted meeting point and marketplace in Stockholm, at the heart of the Nordic art industry. The 2023 edition will be held from May 12-14 at Liljevalchs Konsthall, with the addition of an ambitious new section at the nearby Spritmuseum.
Read on to learn more about this year’s edition of the fair, its forward-looking program, and future developments.
I’ve been the Director and CEO of Market since mid-pandemic 2020. Our first goal was basically to survive as the outlook didn’t look very bright by then, a situation we shared with many event and arts organizations at that time. Now, (soon to be) three fairs later, we are welcoming a record number of galleries and collectors and are standing stronger than ever.
Since our founding by galleries from the Nordic countries, our aim has always been to strengthen the Nordic art scene. The way we do it has refined and evolved over the years, and now we are exclusively focusing on Nordic artists (by origin, residency, or artistic theme) but we welcome plenty of non-Nordic galleries, collectors, and industry professionals.
We are open to any gallery presenting Nordic artists, by origin, residency, or artistic theme, the gallery itself doesn’t need to be Nordic. We love to welcome more non-Nordic galleries! We are also a bit special in the sense that our selection committee only consists of established art industry professionals operating in a completely independent way. The galleries are only selected based on the quality of the art they present and its Nordic relevance, not taking into account any position on the art scene or personal views. That means that the audience will meet ambitious and high-quality presentations at the fair.
That said, the commercial gallery scene is not a true and fair representation of the art scene. We still lag behind in regard to representation, both when it comes to non-white artists and artists from other historically marginalized groups such as Sápmi artists. We see more and more of this also at the fair, but we do have a responsibility to speed up the process.
We wanted to expand the fair for a while now, as we have a surplus of great galleries interested in participating that we just don’t have room for at Liljevalchs. When the opportunity of expanding to Spritmuseum occurred we wanted to do something that would benefit the art scene as a whole. Market Debut exclusively focuses on up-and-coming talent with seven young galleries that have never shown at the fair before.
The Nordic art scene is currently experiencing a new energy and impetus, with numerous galleries and artists making waves. Market Debut is our response to that dynamism and aims to ignite inspiring dialogues, connect, and build relationships between young galleries and Market Art Fair’s strong network of collectors.
Yes, that’s something we are thrilled about. The fair holds the special position of bringing people together, from wealthy collectors and powerful industry professionals to artists and general art enthusiasts, and we want to make the most of this platform by raising important voices and discussions. I’m especially excited about having Dr. Thomas Girst, BMW Head of Culture give a talk. Although we are a Nordic fair, our standpoint is global and filled with wide-ranging insights and inspiration.
I think we are at a challenging time with the global recession, and here in Sweden we also have an extremist right-wing party with influence over cultural politics. Meeting places in the art world, both globally and regionally, will become more important – while we also must question the habit of flying all over the world.
For Market Art Fair, our space limitations are at the same time a blessing and a curse. While hosting the fair at Liljevalchs and Spritmuseum creates a unique and personal feeling, I sometimes toy with the idea of what Market Art Fair could be if we had the possibility of a global-fair setting like a huge tent or exhibition center and could double the number ofexhibitors. Maybe it’s something we should do as a one-off event celebrating the fair’s 20-year anniversary? Time will tell…
The digital iteration of Market Art Fair 2023 will run on Artland until May 28.Sign up here to get VIP accessto the fair online and receive exclusive fair content.
Other interviews you may like:Why the Art World Needs Benchmarks for Online Performance – A New Tool for Industry Insiders and Insights From PacePrivate Art Collections in VR: Raphaël Isvy – Collector Interview
Other relevant sourcesVisit Market Art Fair websitehere",https://usercontent.one/wp/magazine.artland.com/wp-content/uploads/2022/06/artland-magazine-170px.svg?media=1690186145,data_1175c0cd04573bf6e0e14010111b8038_20240926195517,2024-09-26 19:55:17.915920
Raphaël Isvy Collection in VR | Collector Interview,https://magazine.artland.com/raphael-isvy-vr-collector-interview-2/,"Art Collecting Insights
ByBenedetta Ricci
Based in Paris, Raphaël Isvy is a young French collector with a penchant for distorted portraits and sci-fi. We are delighted to feature his collection as part of Artland’s campaign that provides art collectors with cutting-edge VR technology to maximize their passion for collecting.
Read on to learn more about how he started collecting, what he sees in the future of his collection, and much more.
Discover the works from the Raphaël Isvy Collectionhere.
To me, collecting is an addiction—once you start, it’s hard to quit. It all started with vinyl covers, sneakers collab, street art and designer toys. Once I put the first step into it, it evolved into a game and a passion that today means everything to me.
Talent; Balance; Rising stars.
If you check my Instagram (@raph_is) you’ll probably only find figurative, portraits and distorted faces… it’s my thing I don’t know why; probably it’s because I’m a dreamer and a true fan of fantasy and sci-fi.
Probably the George Condo or the Robin Francesca Williams. First of all, they’re masterpieces and a pleasure to have them in my living environment, but they also gave me confidence that I could build something relevant and established, and also prove to the world that I was taking collecting seriously.
Definitely. I started collecting urban art, then edition prints, then cartoon/Kawai, and finally ended up collecting contemporary art. I guess the more you see things, the more you train your eye and refine your taste.
The artwork itself always comes first, but it’s not enough. I look at a lot of things such as pieces in other collections or galleries, and prices, but mostly I aim to buy works that are representative of an artist’s practice. It’s better not to collect a piece if it’s not unique and truly characteristic of the artist’s style.
I display my collection at home, but also at my parents’ and my brother’s places, and in storage. I rotate the hanging a lot to have the chance to enjoy my collection as much as possible. VR is cool but I don’t have the appropriate equipment to fully enjoy it.
I will try mixing young emerging, confirmed and established artists; let’s sayTracey Emin, Christopher Hartmann and Nika Kutateladze.
I always try to enrich the collection with more and more works by blue-chip artists and quality images and enlarge my network while trying to connect the dots between all the actors in the art world.
Always buy what you like and try to build a strong network if you can. The more art you see the better trained will your eye be.
Explore the Raphaël Isvy collectionhereFollow Raphaël Isvy on InstagramhereBrowse other VR exhibitionsExplore other private collections at Artland",https://usercontent.one/wp/magazine.artland.com/wp-content/uploads/2022/06/artland-magazine-170px.svg?media=1690186145,data_1175c0cd04573bf6e0e14010111b8038_20240926195517,2024-09-26 19:55:17.915920
Interview with Contemporary Art Dealer & Collector Adam Baldwin,https://magazine.artland.com/adam-baldwin-interview/,"Interview
ByAdam Hencz
“I’ve always believed that a gallery should serve its collectors by standing as a sort of cultural coterie.”
London-based dealer and collector Adam Baldwin opened his eponymous gallery,Baldwin Contemporary,in his early 30s and soon after gained a reputation for himself as a serious dealer of important post-war and contemporary art.
Operating from a by-appointment space housed within a white stucco-fronted victorian townhouse in London’s exclusive South Kensington district, with his multidisciplinary focus and a deep ambition to carve out a niche for himself in the global art world, it’s easy to see how, in just 4 years, Baldwin has amassed a roster of high profile clients. And what’s more – he’s done this all without having a traditional gallery space.
In this interview, Adam shares his thoughts on the importance of private sales and discusses his gallery’s new publishing venture,Baldwin Books. This series of publications will explore the artists, genres, and themes that Baldwin Contemporary handles, providing an opportunity for collectors to engage in thought-provoking discourse.
From his approach to promotion and sales to the future of the gallery, this interview offers a glimpse into the workings of one of the rapidly emerging talents in the art world.
Your gallery specializes in secondary-market work by acclaimed artists who are well-known for their contributions to popular art genres and movements. It’s also clear from speaking to you that private sales are the central part of your gallery’s strategy. What would need to happen for you to reconsider running a primary program?
You know, I get approached a lot by artists looking for representation. There’s a lot of noise in the gallery world right now, and so I think it’s more important than ever to be honest with yourself as to exactly where your value is. To me, so far, that’s been the handling of post-war and contemporary works of art on thesecondary market, conducted in a private sales setting. I don’t want to lose sight of that.
Running a primary program would be a totally different ballgame, especially to do it at the level I’d want it to operate at. And so, whilst I’m certainly not ruling anything out, it just doesn’t really feel like the right route for us just now.
How would you describe your clientele or a typical Baldwin Contemporary collector?
Informed, passionate, knowledgeable.
Baldwin Contemporary is releasing a series of publications this year – Baldwin Books. Can you tell us more about this project? Who are you working with on these publications?
I’m very excited about this project. Baldwin Books has been created to allow us to present our collectors with intriguing discourse in and around the artists, genres, and thematics that we handle. I’ve always believed that a gallery should serve its collectors by standing as a sort of cultural coterie, and what I’m really focused on right now is building a strong and loyal community of collectors who share our passions and beliefs. And so for that reason alone, this project feels important to me.
As a successful gallery owner and collector, you must have come across many individuals in the art world and beyond who have inspired and impressed you. Are there any other dealers or professionals, past or present, who you particularly admire?
Saatchi. Gagosian. Castelli.
Are there any specific artists or movements you consider undervalued today? How do you balance the desire to take risks on lesser-known or underrecognized artists with the need to sell works guaranteed to perform well on the market?
I get asked this question a lot. The truth is that periods of dislocation between art history and the art market are much more common than they probably should be. Just look at Rauschenberg’s market. Or the overall under-appreciation of female artists throughout art history. Or, dare I say it, some of the prices are currently being spent on emerging work right now.
I’ve said this before, but one particular area where I see value right now is inthe early YBAs. And I’m not talking about theHirstandEminmarkets but rather the other members of the group who were still hugely important in the movement. I’m talking aboutGary Hume‘s hospital doors,Gavin Turk‘s trompe-l’oeil series, Angus Fairhurst’s gorillas,Sarah Lucas‘ Bunny girls, Jake and Dinos Chapman’s iconoclastic sculptures, Abigail Lane’s ink pads and so on. And there’s loads more. Some of these works are hugely important pieces when contextualized within art history, but the market right now just isn’t reflecting this. I’ve seen so many of these works come to market over the past couple of years at what I think are pretty low prices relative to their historical importance. It’s a good buying opportunity right now.
“For me it’s not about pursuing growth for growth’s sake. Right now, I’m just happy honing in on what we’re getting right and building a passionate community.”
I’m curious about your approach to promotion and sales in the art world. It is a fiercely competitive field, so how do you generate enthusiasm and momentum for your gallery and position it within high-profile collector circles?
We focus on private sales, so we don’t need to operate an extensive exhibition-led marketing strategy. It’s just not our style.
Our modus operandi is actually quite simple – we want to work with passionate collectors around the world to help them build and manage important, respected, and interesting collections of post-war and contemporary art. At the end of the day, that’s really what it’s all about, right? And we’re fortunate enough to have been able to build the gallery around a loyal community of collectors who follow us and trust what we do. And right now, we’re just focused on serving them in the best way possible.
Whilst most of what I spend my time doing these days is what you’d call ‘offline,’ my team here runs a fairly extensive online presence too. For our online efforts, most of the inventory we market online is blue-chip prints and multiples up to about £100,000. That’s actually how we first got started.
What advice would you give to new gallerists just starting out?
Be honest. Be reliable. And learn quick.
You opened a gallery in your early 30s, and within just four years, you have rapidly established your name in the global contemporary art scene. As you look towards the future, where do you see the gallery in another four years, and what are your ambitions and strategies for continuing to grow and evolve? You mentioned researching the possibility of opening an office in the US. What other locations would you consider expanding to in the future?
A lot of my clients are located in the US, and we’ve kept inventory over there for some time now too. So opening a US space at some point, probably Los Angeles would be an obvious next step for us. But frankly speaking, right now, we’re just focusing on a centralization strategy here in London. We’ve grown over the past couple of years which we’re very grateful for, but for me, it’s not about pursuing growth for growth’s sake. Right now, I’m just happy honing in on what we’re getting right and building out our community from here.
The primary vs. the secondary art marketA History of Art DealingThe Shows That Made Contemporary Art History",https://usercontent.one/wp/magazine.artland.com/wp-content/uploads/2022/06/artland-magazine-170px.svg?media=1690186145,data_1175c0cd04573bf6e0e14010111b8038_20240926195517,2024-09-26 19:55:17.915920
Fals & Prates Collection in VR | Collector Interview,https://magazine.artland.com/fals-prates-vr-interview/,"Art Collecting Insights
ByBenedetta Ricci
“We prioritize the emotions and stories that art evokes rather than focusing solely on whether or not it aligns with our personal taste. “
Artland caught up with Danish art advisor, curator, and collector J.B. Fals on the occasion of the recent Virtual Reality release of the contemporary art collection he shares with his partner R. Prates. Read on to learn more about how the collection started, where it is heading, and several points in between.
Explore a selection of works from the Fals & Prates Collection in VRhere.
Ever since I was young, I have been captivated by the creativity, authenticity, and courage of artists. In my mid-twenties I realized that my ability was not to create art but to help artists facilitate their unique skills. ThroughOriginal Paper Worksand curating art shows, I have now found the way to best express my ability, and I couldn’t be more pleased. I started my collection in my twenties by myself, but later in life I joined forces with my significant other, and we now share the passion for art collecting.
Artists We Admire.
Our collection is mostly divided into two main sections. The first one features artists who currently reside or work in Denmark. Living in Copenhagen makes it convenient for us to interact with local artists. The second one focuses on contemporary artists in and around the city of London. London is a special place and the amount of creative forces in the city is unbelievable. We have been fortunate to cultivate friendships and connections in London over the years.
Each piece of art holds a unique story and a special place in our hearts. I would love to share the stories of all of them, but if I had to choose one, I would highlight “Boat trip from Hoxton to Wick” byIgor Moritz. This painting was featured in a group show that I curated in Copenhagen and as soon as I unpacked it, I was hypnotised by it. I later had the opportunity to visit Igor in his Hackney studio and saw the same canal and houseboats that were depicted in the painting. It was an extraordinary moment for me as both a collector and a curator.
Others may argue that we have a specific taste when it comes to collecting art, but that is not how we view it. We prioritize the emotions and stories that art evokes rather than focusing solely on whether or not it aligns with our personal taste. Art would lose relevance over time if we were to choose based solely on aesthetics and personal taste.
While if the selection is based on the emotions and stories art excites, we can be sure that that specific artwork will always hold a special place in our hearts.
Are you touched by the artwork? Are you moved by the artist?
Does it evoke something within you, be it positive or negative? Art is all about emotions, and not all emotions are pleasant, but they are all still very meaningful.
Currently, I am particularly drawn to the work of Austrian artist Anna Rettl. She is inspired by accomplished female artists such as Miriam Cahn and Anne Kollwitz, yet still manages to make her paintings entirely her own. I am also eagerly looking forward to Shuo Hao’s solo exhibition later this year. I am drawn to Hao’s art as it takes inspiration from both Western and Eastern cultures. Lastly, I would like to mention Danish artist Tomas Leth. I acquired my first artworks from Tomas in 2019. His abstract paintings and paper works are truly remarkable; they possess an immense depth while still being delicate. I believe our collection could benefit from more abstract artworks like his.
We are eager to expand the diversity of our collection. We hope to acquire more artworks from artists who worked all throughout the past century. Currently, the collection has a strong focus on contemporary art, but in the next decade we hope to add more pieces from the second half of the 20th century.
I try to avoid seeking advice, preferring instead to engage in meaningful conversations with artists. I am interested in the craft and thought process behind an artwork and not in the urge to collect.
My two pieces of advice for aspiring collectors would be:
First, curate a collection with purpose and significance rather than simply following current trends. Your collection should remain relevant and meaningful 20-30 years from now. Remember, collecting art is about more than just having something aesthetically pleasing to display in your home. To truly be a collector, immerse yourself in the art and develop a deep understanding of it.
Secondly, if you are committed to collecting, you have to be patient and disciplined. Galleries may tempt you with the latest and greatest, but stick to your plan and don’t be afraid to say no if that doesn’t align with the direction of your collection. Building a collection takes time and requires a mass amount of patience and discipline.
Explore the Fals & Prates collectionhereFollow J. B. Fals on InstagramhereBrowse other private art collections and exhibitions in VR",https://usercontent.one/wp/magazine.artland.com/wp-content/uploads/2022/06/artland-magazine-170px.svg?media=1690186145,data_1175c0cd04573bf6e0e14010111b8038_20240926195517,2024-09-26 19:55:17.915920
