name,link,bio,image,special_id,collected_at
Hongrui Liu,https://www.internationalcuratorsforum.org/people/hongrui-liu/,"Hongrui Liu is a multimedia artist based in HongKong/London.
Interested in creative experimentation across mediums and the abstraction between what’s sounded and heard. His practice is informed by existentialist theory to naturalist beliefs. Working with the idea of reconfiguring space and time, relocating environments through sound. His soundwork archives and resounds sites with re-constructed sonic environments. Re-activating spaces with a touch of positive silence and fostering a collective voice. Through blending the listening environment with the physical he encourages listening to what is unheard.Raising questions about how sound affects us in our daily lives. His visual work is aimed at posing a question through direct use of materials at hand and juxtaposes forms with performative aspects. Coming from a buddhist background, he also considers the forging of positive intents and connection between all existing life-forms. Relating and responding to sites carefully.",https://www.internationalcuratorsforum.org/wp-content/uploads/2022/03/Screenshot-2022-03-01-at-15.00.12-768x499.png,data_a478f401dc7d5fee5c6b49530448bbd6_20240926201300,2024-09-26 20:13:00.558771
Errol Lloyd,https://www.internationalcuratorsforum.org/people/errol-lloyd/,"Errol Lloyd (born 1943) is a Jamaican-born artist, writer, art critic, editor and arts administrator. Since the 1960s he has been based in London, UK, where he studied law. He joined the Caribbean Artists at its inception in 1966, and exhibited his paintings and sculpture. The latter included commissioned busts of prominent West Indians, including CLR James, writer and political, Sir Alexander Bustamante, Prime Minister of Jamaica, Garfield Sobers, cricketer, Lord Pitt, politician, John LaRose, poet and publisher and Linton Kwesi Johnson.
Now well known as a book illustrator, he was Highly Commended  for the Kate Greenaway Medal in 1973 for his work on My Brother Sean by Petronella Breinburg. He also produced book jackets, greetings cards and other material for the pioneering black-owned publishing companies in London, New Beacon Books, Bogle-L’Ouverture Publications, and Allison and Busby.
His children picture books for mainstream publishers such as Random House, Penguin Books and Oxford University Press went into several foreign editions and a couple were on the national curriculum. His 1995 novel for teenagers, was runner up for the Carnegie Medal. His work has been featured in numerous publications, including American publication, Artists of the Page, based on interviews by Ken and Sylvia Marantz of twenty four British children’s book writers and illustrators.
Lloyd for some years had an association with the Minorities’ Arts Advisory Service (MAAS), and was Art Editor for their inter-cultural magazine, Artrage.   His short stories have been published by New Beacon Review, the Art Edition of literary magazine Staple and Artrage.  He also produced book jackets, greetings cards and other material for the pioneering black-owned publishing companies in London, New Beacon Books, Bogle-L’Ouverture Publications, and Allison and Busby.
He was formerly a teacher for Advanced Painting at the Camden Arts Centre, and also served on the Visual Arts Panel for Arts Council England. He is also known as a musician, playwright and storyteller. He is the subject of a photograph by Horace Ove at the National Portrait Gallery. He also features in Ove’s film, Dream to Change the World, based on Lloyd’s interview of John LaRose, and also features his piano accompaniment to John LaRose’s poetry reading.
He has featured in some notable group exhibitions, including Transforming the Crown, New York; No Colour Bar, at the Guildhall Art Gallery; Get Up Stand Up Now at Somerset House; London and The Lie of the Land at Milton Keynes Gallery alongside such notable British artists as  Gainsborough, J.M.W. Turner, Henry Moore, Bridget Riley and Yinka Shonibare.
Lloyd’s portrait of poet and  historian, Kamau Brathwaite, commissioned by Pembroke College, Cambridge University, is on permanent display in the Hall which houses portraits of distinguished alumni.",https://www.internationalcuratorsforum.org/wp-content/uploads/2017/03/IMG_9626-768x576.jpg,data_a478f401dc7d5fee5c6b49530448bbd6_20240926201300,2024-09-26 20:13:00.558771
Beatriz Lobo,https://www.internationalcuratorsforum.org/people/beatriz-lobo/,"Beatriz is responsible for development and delivery of iniva’s public programme working with artists and key partners to implement artistic production through research, radical art education, unlearning, and wellbeing practices. The curator is responsible for instilling a practice of care in building relationships with artists of African, Caribbean, Asian, Middle Eastern, Indigenous and Latin American descent and their communities.",,data_a478f401dc7d5fee5c6b49530448bbd6_20240926201300,2024-09-26 20:13:00.558771
Hew Locke,https://www.internationalcuratorsforum.org/people/hew-locke/,"Hew Locke was born in Edinburgh, UK, in 1959; lived from 1966 to 1980 in Georgetown, Guyana; and is currently based in London.
He obtained a B.A. Fine Art in Falmouth (1988) and an M.A. Sculpture at the Royal College of Art, London (1994). In 2000 he won both a Paul Hamlyn Award and an East International Award.  In 2022 he was elected a member of The Royal Academy of Arts.
His work is represented in many collections including those of the The Government Art Collection, The Pérez Art Museum Miami, The Tate Gallery, The Arts Council of England, The National Trust, The Metropolitan Museum of Art, New York, The Brooklyn Museum, New York, 21c, The New Art Gallery Walsall, The Victoria & Albert Museum, The Imperial War Museum, The British Museum and The Henry Moore Institute, Leeds.",https://www.internationalcuratorsforum.org/wp-content/uploads/2017/02/Tate-Masterclass3-768x512.jpg,data_a478f401dc7d5fee5c6b49530448bbd6_20240926201300,2024-09-26 20:13:00.558771
Alanna Lockward,https://www.internationalcuratorsforum.org/people/alanna-lockward/,"Alanna Lockward was a Berlin and Santo Domingo based Dominican author, curator and filmmaker. She was the founding director of Art Labour Archives, an exceptional platform spiraling consistently on theory, political activism and art since 1996. Her interests were Caribbean marronage discursive and mystical legacies in time-based practices, critical race theory, decolonial aesthetics/aesthesis, Blak feminism and womanist ethics. Lockward was the author of Apremio: apuntes sobre el pensamiento y la creación contemporánea desde el Caribe (Cendeac, 2006), a collection of essays, the short novel Marassà & The Nothingness (Partridge Africa 2016) and Un Haití Dominicano. Tatuajes fantasmas y narrativas bilaterales (1994-2014), a compilation of her investigative work on the history and current challenges between both island-nations (Santuario 2014).
She was cultural editor of Listín Diario, research journalist of Rumbo magazine and columnist of the Miami Herald and is currently a columnist of Acento.com.do. Her essays and reviews have been widely published internationally by Afrikadaa, Atlántica, ARTECONTEXTO, Arte X Excelencias, Art Nexus, Caribbean InTransit and Savvy Journal. In 2014 she was the guest columnist  of Camera Austria.
At the Museo de Arte Moderno (Santo Domingo) Lockward was appointed Director of International Affairs (1988) and was designated as Selection Jury of the XX Bienal Nacional de Artes Visuales (1996) and as Award Jury in its 26 edition (2011).
She was adjunct professor of audiovisual theory and investigative journalism at PUCMM and has been a guest lecturer at the Humboldt Universität zu Berlin, the Decolonial Summer School Middelburg,  the University of Warwick, Dutch Art Institute and Goldsmiths University of London and has been a panelist at the University of Kwa-Zulu Natal (South Africa) and Duke, Columbia and Princeton Universities in the US. She is academic advisor of Transart Institute and is associated scholar of Young Scholars Network Black Diaspora and Germany. She has conceptualized and curated the groundbreaking trans-disciplinary meeting BE.BOP. BLACK EUROPE BODY POLITICS (2012-2016).
Alanna Lockward has been awarded by the Allianz Cultural Foundation, the Danish Arts Council and the Nordic Council of Ministers. Her first documentary project on Black Liberation Theology and the transnational history of the African Methodist Episcopal Church (AME) received the production prize FONPROCINE 2013.",https://www.internationalcuratorsforum.org/wp-content/uploads/2020/11/Curating-the-International-Diaspora-768x512.jpg,data_a478f401dc7d5fee5c6b49530448bbd6_20240926201300,2024-09-26 20:13:00.558771
Rudy Loewe,https://www.internationalcuratorsforum.org/people/rudy-loewe/,"Rudy Loewe (b. 1987) is an artist visualising black histories and social politics through painting, drawing and text.
They began a Techne funded practice-based PhD at the University of the Arts London in 2021. This research critiques Britain’s role in suppressing Black Power in the English-speaking Caribbean, during the 60s and 70s. Loewe is creating paintings and drawings that unravel this history included in recently declassified Foreign & Commonwealth Office records. Their approach to painting speaks to their background in comics and illustration — combining  text, image and sequential narrative.
Recent exhibitions includeA Significant Threat, VITRINE Fitzrovia, London (2023);uMoya: the sacred return of lost things, Liverpool Biennial (2023);Unattributable Briefs: Act Two, Orleans House Gallery, London (2023);Unattributable Briefs: Act One, Staffordshire St., London (2022);New Contemporaries, Humber Street Gallery and South London Gallery (2022);Back to Earth, Serpentine Gallery, London (2022); andNAE Open 22, New Art Exchange, Nottingham (2022).",https://www.internationalcuratorsforum.org/wp-content/uploads/2023/07/Rody-Loewe-768x768.jpeg,data_a478f401dc7d5fee5c6b49530448bbd6_20240926201300,2024-09-26 20:13:00.558771
Lynn Lu,https://www.internationalcuratorsforum.org/people/lynn-lu/,"Lynn Lu received her BFA from Carnegie Mellon University with a major in Sculpture and a minor in Graphic Design. She studied with Christian Boltanski at the École Nationale Supérieure des Beaux-Arts Paris, then earned her MFA in New Genres at the San Francisco Art Institute. She then spent a year as a post-grad researcher in Kawamata Tadashi’s atelier at Tokyo National University of Fine Art and Music (Geidai), and subsequently completed a PhD (ABD) at Musashino Art University in Tokyo on a full scholarship from the Japanese Ministry of Foreign Affairs. In 2010 she was awarded the degree of Doctor of Philosophy by the University of Newcastle in Australia.
Among other honours, Lynn was awarded Southampton Solent University’s Research and Enterprise Grant, numerous Singapore National Arts Council International Development Grants, the National Arts Council Emerging Artist Grant, and the Lee Foundation Grant. She received the Lois Nellie Gill Award from the Ucross Foundation, and the Samuel Rosenberg Senior Art Award from Carnegie Mellon University. She has also been granted several prestigious artist fellowships, including residencies at the Ucross Foundation, Djerassi Resident Artist Program, Sitka Center for Art and Ecology, and Dorland Mountain Arts Colony in the United States, Unitec in New Zealand, Floating Platforms in Finland, and CCLAP in the UK.
Lynn exhibits, performs, and lectures extensively worldwide. Recent venues include SFMOMA (2021), National Gallery Singapore (2021), Staatlichen Kunstsammlungen Dresden (2019), Framer Framed (2018), Science Gallery London (2017), Saatchi Gallery (2017), Palais de Tokyo (2015), The Barbican (2015), Perth Institute of Contemporary Arts (2013), Tate Modern (2010), Beijing 798 Art Zone (2009), and Singapore Art Museum (2007).
Lynn is a Visiting Artist at London College of Communication, University of the Arts London, an Associate Lecturer at Nanyang Academy of Fine Arts, and an Associate Artist at ]performance s p a c e [.",https://www.internationalcuratorsforum.org/wp-content/uploads/2022/11/img_1342a-768x512.webp,data_a478f401dc7d5fee5c6b49530448bbd6_20240926201300,2024-09-26 20:13:00.558771
Catherine Lucktaylor,https://www.internationalcuratorsforum.org/people/catherine-lucktaylor/,,https://www.internationalcuratorsforum.org/wp-content/uploads/2022/11/Venice-2007-panel-768x454.png,data_a478f401dc7d5fee5c6b49530448bbd6_20240926201300,2024-09-26 20:13:00.558771
Gabria Lupone,https://www.internationalcuratorsforum.org/people/gabria-lupone/,"Gabria Lupone is a Project Manager at the Design Museum. She has worked as a Project Manager for Manifesta, the Design Biennial, and ICF’s Diaspora Pavilion exhibition in Venice in 2017.",https://www.internationalcuratorsforum.org/wp-content/uploads/2020/05/Hew-Locke-Diaspora-Pavilion-768x512.jpg,data_a478f401dc7d5fee5c6b49530448bbd6_20240926201300,2024-09-26 20:13:00.558771
John Lyons,https://www.internationalcuratorsforum.org/people/john-lyons/,"John Lyons is a painter and poet, born in 1933 in Port-of-Spain, Trinidad and Tobago. When he was nine, his mother died after a short illness and he and his three siblings moved to rural Tobago to live with his grandmother. There, he discovered and sought refuge in the works of Walter Scott, Conan Doyle, and other authors he was able to find in the library in Scarborough. In 1948 Lyons returned to Trinidad to live with his father and stepmother. After successfully passing the Senior Cambridge exam, Lyons had to forego further study to lessen the financial burden on his family. He passed the Civil Service entrance examination and worked for five years in the Civil Service, during which time he continued with his passion for writing and painting.
​In 1959 Lyons was accepted into Goldsmiths College in London, and graduated in 1964 with a National Diploma of Design. He gained an Art Teachers’ Diploma at the University of Newcastle-upon-Tyne in 1965; his first job was at South Shields Grammar Technical School for Boys. In 1967 he moved to Manchester where he worked in secondary schools for nine years, before becoming an Art and Design lecturer in South Trafford College. He taught at the college for seventeen years, all the time continuing with his writing and painting. In 1987 Lyons won a number of poetry prizes: second prize in the Cultureword Poetry Competition; the Peterloo Poets Afro-Caribbean and Asian prize; a commendation in the National Poetry Competition, and in the Peterloo Poetry Competition.
​Lyons was co-founder of the Hourglass Studio Gallery in Hebden Bridge, West Yorkshire, where he directed art and Creative Writing workshops with his partner Jean Rees. The arts educational arm of the organisation became a charity, and he remained on the Board of Trustees until 2009, when it lost its Art Council funding in the general cuts.
​Lyons first full collection of poems, Lure of the Cascadura, was published in 1989 by Bogle L’Ouverture Publications, for which he received a major Arts Council award. In 2003 he was given the Windrush Arts Achiever Award. Aside from his numerous contributions to poetry anthologies, he has 8 published poetry collections, the most recent being: A Carib Being in Cymru and Dancing in the Rain, both in 2015.
​Lyons has been exhibiting his paintings since the 1960s and describes his approach to picture making as: “I enter into a playful dialogue with the work in which line, shape, texture and vibrant colour are brought together to inhabit a theme usually based on Caribbean folklore and mythology.” He was a participant in the exhibition ‘No Colour Bar: Black British Art in Action 1960–1990’ at the Guildhall Art Gallery, which took inspiration from the radical lives of Guyanese activists Eric and Jessica Huntley and the publishing company they founded, Bogle-L’Ouverture. Lyons also had several paintings included in the critically acclaimed exhibition ‘Life Between Islands: Caribbean – British Art 1950s – Now’ held at Tate Britain in 2021-22.
​A number of public collections hold artwork by John Lyons including Rochdale Art Gallery, Huddersfield Art Gallery, the Victoria and Albert Museum’s Word & Image Print Collection and the Arts Council National Collection.",https://www.internationalcuratorsforum.org/wp-content/uploads/2022/11/John-Lyons-Andrew-Pierre-Hart-Black-Cultural-Archives-2022-e1669290871566-768x449.jpg,data_a478f401dc7d5fee5c6b49530448bbd6_20240926201300,2024-09-26 20:13:00.558771
Alexandra MacGilp,https://www.internationalcuratorsforum.org/people/alexandra-macgilp/,"Dr. Alexandra MacGilp is an independent curator and writer based in London.
She received her BA in English and History of Art from University College London, and has a Masters in History of Art from Birkbeck College, London, and in Curating Contemporary Art from the Royal College of Art, London. She has a doctorate in History of Art, writing on the development of the Tate collection; this was an AHRC-funded collaborative project between the University of Reading and Tate Britain.
She is interested in film, video, performance and installation practices and archive materials. Previous posts include Curator at Maraya Art Centre.",https://www.internationalcuratorsforum.org/wp-content/uploads/2019/08/UNADJUSTEDNONRAW_thumb_3831-768x431.jpg,data_a478f401dc7d5fee5c6b49530448bbd6_20240926201300,2024-09-26 20:13:00.558771
Sekai Machache,https://www.internationalcuratorsforum.org/people/sekai-machache/,"Sekai Machache (she/they) is a Zimbabwean-Scottish visual artist and curator based in Glasgow, Scotland.




",https://www.internationalcuratorsforum.org/wp-content/uploads/2023/07/Sekai-Machache-768x951.jpg,data_a478f401dc7d5fee5c6b49530448bbd6_20240926201300,2024-09-26 20:13:00.558771
Louise Macmillan,https://www.internationalcuratorsforum.org/people/louise-macmillan/,,https://www.internationalcuratorsforum.org/wp-content/uploads/2022/11/20_022_feature-768x431.jpeg,data_a478f401dc7d5fee5c6b49530448bbd6_20240926201300,2024-09-26 20:13:00.558771
Paul Maheke,https://www.internationalcuratorsforum.org/people/paul-maheke/,"Paul Maheke (b. 1985) graduated from Cergy School of Fine Arts and is an Open School East (London) alum. Recent solo exhibitions include “A fire circle for a public hearing” at the Chisenhale gallery in London (2018) and Vleeshal Middelburg (2019), and “I Lost Track of the Swarm” at the South London Gallery (2016). Selected group exhibitions include “Le centre ne peut tenir” at Lafayette Anticipations in Paris (2018), “Ten Days Six Nights” at Tate Modern in London (2017), and the Diaspora Pavilion at the 57th Venice Biennale (2017).
His practice is grounded in emancipatory and decolonial thought with an emphasis on cultural identities and new subjectivities. His current research focuses – through video, installation, sculpture and furtive interventions – on the body as both an archive and a territory, as a utopia to be reimagined through different strategies of resistance. With particular attention to dance, he proposes to defuse the power relations that shape Western imaginations and to rearticulate the representations that emerge from them.",https://www.internationalcuratorsforum.org/wp-content/uploads/2019/07/Diaspora-Pavilion-Paul-Maheke-768x512.jpg,data_a478f401dc7d5fee5c6b49530448bbd6_20240926201300,2024-09-26 20:13:00.558771
Rubiane Maia,https://www.internationalcuratorsforum.org/people/rubiane-maia/,"Rubiane Maia is a Brazilian visual artist based between Folkestone, UK and Vitória, Brazil.
She completed a degree in Visual Arts and a Master degree in Institutional Psychology at Federal University of Espírito Santo, Brazil. Her artwork is a hybrid practice across performance, video, installation and text, occasionally flirting with drawing and collage. She is attracted by states of synergy, encompassing the invisible relationships of affect and flux, and investigates the body in order to amplify the possibilities of perception beyond the habitual. By doing so, she is constantly re-elaborating her personal notion of existential territories (spatial, temporal, cognitive, social and political). More recently, she has been researching the concept of memory and its relationship with language and channeling, often making use of personal narratives as a device for action and resilience. Since 2018 she has been working on the creation of a ‘Book-Performance’, a series of actions in response to specific autobiographical texts particularly influenced by experiences of racism and misogyny.",https://www.internationalcuratorsforum.org/wp-content/uploads/2022/11/048_HD_180906_4583_©-Hydar-Dewachi-768x512.jpg,data_a478f401dc7d5fee5c6b49530448bbd6_20240926201300,2024-09-26 20:13:00.558771
Evariste Maiga,https://www.internationalcuratorsforum.org/people/evariste-maiga/,"Evariste Maïga is a trans-disciplinary artist based in Geneva, working with a broad range of media including video, photography, installation, print, drawing and text.
Taking inspiration from daily encounters, anecdotes and the peripheral, his work explores topics such as inherent potential, visibility, singularity and acting in a broad sense. Simple gestures, performativity and humour tend to influence the aesthetic and the analytical processes that occur in Maïga’s work. During the past few years Maïga has particularly explored our relation to food found in African culture and its visual presence in popular Western culture.
Evariste Maïga has exhibited internationally, among others at The Liverpool Biennale, The Institute of Contemporary Art, London — Bloomberg New Contemporaries — Art Night, London  — Off Course Art Fair, Brussels — the 4th Thessaloniki Biennale, Greece — The Cooper Gallery, Scotland.",https://www.internationalcuratorsforum.org/wp-content/uploads/2016/11/IMG_9190-768x512.jpg,data_a478f401dc7d5fee5c6b49530448bbd6_20240926201300,2024-09-26 20:13:00.558771
Elijah Maja,https://www.internationalcuratorsforum.org/people/elijah-maja/,"Elijah Maja is an artist and researcher from London. Working across methods of practice that actively engage audio-visual provocations into notions of ritual, process and their lineage as intangible spaces for activation.",https://www.internationalcuratorsforum.org/wp-content/uploads/2022/03/89880002-768x509.jpg,data_a478f401dc7d5fee5c6b49530448bbd6_20240926201300,2024-09-26 20:13:00.558771
Latifa Bint Maktoum,https://www.internationalcuratorsforum.org/people/latifa-bint-maktoum/,,https://www.internationalcuratorsforum.org/wp-content/uploads/2020/11/Sharjah-Biennial-2009-768x512.jpg,data_a478f401dc7d5fee5c6b49530448bbd6_20240926201300,2024-09-26 20:13:00.558771
Djofray Makumbu,https://www.internationalcuratorsforum.org/people/djofray-makumbu/,"Djofray Makumbu is a British Congolese artist born and based in East London. His work draws on his own personal experiences and those of the people close to him, and he often collaborates with friends and family.
Recent projects have focused on the shame and stigma of mental health difficulties and disability, the pressures and violence of inner-city life from the perspective of young people and the joy of music and dancing.
Djofray works predominantly in moving-image, bringing together different techniques combining stop-motion animation, video footage and hand drawn/painted elements which are sometimes presented alongside live performances or dance. Each element of the work is carefully self-made, from hand built sets and hand stitched garments for Claymation characters, to soundtracks that are developed closely with Djofray’s brother
Djofray graduated from the BA Fine Art programme at Goldsmiths in 2018 and was awarded the Alumno/SPACE Studio Bursary as a result of his degree show exhibition. In 2020, Djofray won a Goldsmiths Exhibitions Hub commission, in partnership with the London Community Video Archive, to make Hello Mr Officer, a moving image work that sees young Black men from across London share their experiences of being harassed by the police.
The work uses stop-motion, watercolour and rotoscope alongside archive material from The People’s Account (1987) by Ceddo Film Collective held in the LCVA archive. The work was exhibited at South London Gallery in 2021. In 2021, Djofray was awarded the LOEWE FOUNDATION / Studio Voltaire award and also undertook a Guest Projects digital residency with the Yinka Shonibare Foundation.",https://www.internationalcuratorsforum.org/wp-content/uploads/2022/11/In-the-Studio-with-Djofray-Makumbu-768x480.png,data_a478f401dc7d5fee5c6b49530448bbd6_20240926201300,2024-09-26 20:13:00.558771
Roger Malbert,https://www.internationalcuratorsforum.org/people/roger-malbert/,"Roger Malbert is a curator and writer on contemporary art. Until 2018 he was Head of Hayward Gallery Touring at the Southbank Centre, London, where he was responsible for a wide-ranging programme of exhibitions touring to galleries and museums across the UK, including an innovative series of artist-curated shows. He has written for The Art Newspaper and TLS, and has written catalogue essays on Michael Armitage, Omar Ba, Louise Bourgeois, Matta, Goya, William Kentridge, Richard Wentworth and Tacita Dean. In 2018 he was awarded an OBE for services to art.",https://www.internationalcuratorsforum.org/wp-content/uploads/2022/11/Hew-Locke-Sandy-Nairne-Rogert-Malbert-Andrea-Schlieker-Claire-Doherty-Alex-Farquharson-768x490.jpg,data_a478f401dc7d5fee5c6b49530448bbd6_20240926201300,2024-09-26 20:13:00.558771
